IMAGEN,"Stock
anterior",STOCK ACTUAL,Código,Nombre,CATEGORIA,Sub categoria,Marca,PRECIO,
,1,1,00002125,Uniqlo SpongeBob SquarePants Cactus Plant Flea Market UT Green,STREETWEAR LUJOSO,T-SHIRT,UNIQLO,300,
,1,1,00002132,SpongeBob SquarePants Cactus Plant Flea Market UT Graphic T-Shirt - Size L - Color blanco,STREETWEAR LUJOSO,T-SHIRT,UNIQLO,300,
,1,1,00002133,SpongeBob SquarePants Cactus Plant Flea Market UT Graphic T-Shirt - Size XL - Color blanco,STREETWEAR LUJOSO,T-SHIRT,UNIQLO,300,
,1,,00002135,Kaws x Uniqlo Warhol UT Graphic White - Size S,,T-SHIRT,UNIQLO X KAWS,300,
,149,2,00002373,Kaws x Warhol UT Graphic banana - Size XL,STREETWEAR LUJOSO,T-SHIRT,UNIQLO X KAWS,300,
,5,5,17000011,REX - Rexotic Belt Phantom Grey Chrome Buckle,STREETWEAR LUJOSO,CORREA,Rexotic,759,
,2,2,17000012,REX - Rexotic Card Holder - Storn Grey,STREETWEAR LUJOSO,TARJETERO,Rexotic,259,
,1,1,17000013,REX - Rexotic Card Holder - Storn Black,STREETWEAR LUJOSO,TARJETERO,Rexotic,259,
,1,1,17000014,REX - Rexotic Monogram Long Sleeve Black - Size M,STREETWEAR LUJOSO,T-SHIRT MANGA LARGA,Rexotic,250,
,1,1,17000015,REX - Rexotic Monogram Long Sleeve Black - Size L,STREETWEAR LUJOSO,T-SHIRT MANGA LARGA,Rexotic,250,
,1,,16000025,JAM - Supreme Star Fleece Jacket Natural - Size M - Color Crema,,JACKET,SUPREME,2100,
,0,,00000502,Supreme Shoulder Bag Black,,MORRAL,SUPREME,550,
,1,1,16000026,JAM - Supreme/Hanes Boxer Briefs Verde Pack x 2 - Size M,STREETWEAR LUJOSO,BOXER,SUPREME,399,
,1,1,16000027,JAM - Supreme/Hanes Tagless Tees White Pack x 3 - Size L,STREETWEAR LUJOSO,T-SHIRT,SUPREME,499,
,1, ,00000109,Adidas Yeezy Slide Azure - 39 (6 US),,YEEZY SLIDE,ADIDAS,,
,1,1,00003043,Off Whte Gothic Arr Popl Bowling SH Black White - Size XL (52) - Color Negro,DISEÑADOR,CAMISA,OFF WHITE,1800,
,1,1,00003113,Off White Ri_Pantheon Holiday Shirt White Beige - Size XL,DISEÑADOR,CAMISA,OFF WHITE,1800,
,1,2,00002377,Off White Gothic Logo Baseball Shirt White/Red - Size L (48),DISEÑADOR,JERSEY,OFF WHITE,1800,
,1,1,00002378,Off White Gothic Logo Baseball Shirt White/Red - Size XL (52),DISEÑADOR,JERSEY,OFF WHITE,1800,
,1,,00003112,Off White Ri_Pantheon Holiday Shirt White Beige - Size L,,CAMISA,OFF WHITE,1800,
,1,1,00004425,Palm Angels Chaqueta de chándal Denim Blue - Size S,DISEÑADOR ,CASACA JEANS,PALM ANGELS,1800,
,0,,00000235,Supreme X Mlb Teams Box Logo New Era Black - Chicago Talla: 7 1/4,,GORRA CERRADA PLANA,SUPREME X MLB,550,
,1,1,00000236,Supreme X Mlb Teams Box Logo New Era Dark Green Oakland Athletics Talla: 7 1/4,STREETWEAR LUJOSO,GORRA CERRADA PLANA,SUPREME X MLB,550,
,1,1,00000237,Supreme X Mlb Teams Box Logo New Era Light Blue Cardinals -Talla: 7 1/4,STREETWEAR LUJOSO,GORRA CERRADA PLANA,SUPREME X MLB,550,
,1,1,00000238,Supreme X Mlb Teams Box New Era Blue Seattle Mariners -Talla: 7 1/4,STREETWEAR LUJOSO,GORRA CERRADA PLANA,SUPREME X MLB,550,
,1,1,00000239,Supreme Military Camp Sap Black (Fw 25) -Regulable,STREETWEAR LUJOSO,GORRA REGULABLE PLANA,SUPREME,550,
,0,,00000240,Supreme Military Camp Cap Blue Camo- Regulable,,GORRA REGULABLE PLANA,SUPREME,550,
,1,1,00000241,Supreme Splatter 6 - Panel Black  -Regulable,STREETWEAR LUJOSO,GORRA REGULABLE CURVA,SUPREME,550,
,1,1,00000242,Supreme Splatter 6 - Panel Red -Regulable,STREETWEAR LUJOSO,GORRA REGULABLE CURVA,SUPREME,550,
,1,1,00000243,Supreme Pigment Coated Canvas S Logo 6-Panel Pink -Regulable,STREETWEAR LUJOSO,GORRA REGULABLE CURVA,SUPREME,550,
,0,,00000244,Eric Emanuel College Nort Carolina Blue White -Regulable,,GORRA CERRADA PLANA,Eric Emanuel,650,
,1,1,00000245,Gallery Dept. Logo Truck Black -Regulable,STREETWEAR LUJOSO,GORRA REGULABLE CURVA,GALLERY DEPT.,899,
,1,1,00000246,Gallery Dept. Upside Down Logo Trucker Black -Regulable,STREETWEAR LUJOSO,GORRA REGULABLE CURVA,GALLERY DEPT.,899,
,3,3,00000800,Odyssey Candee Armaf (Exhibido),,DULCE,ARMAF,250,
,1,1,00000801,Odyssey Homme Armaf (Exhibido),,CITRICO,ARMAF,250,
,1,1,00000802,Yara Candy Lattafa (Exhibido),,DULCE,LATTAFA,250,
,3,3,00000803,Odyssey Tyrant (Exhibido),,AMADERADO,ARMAF,250,
,3,3,00000804,Fakhar Extrait Lattafa (Exhibido),,AMADERADO,LATTAFA,250,
,2,2,00000805,Shaheen Silver Lattafa (Exhibido),,CITRICO,LATTAFA,250,
,2,2,00000806,The Kingdom For Women,,CITRICO,LATTAFA,250,
,2,2,00000807,Lattafa Bade´e al Oud Oud For Glory Edp Unisex  (Exhibido),,AMADERADO,LATTAFA,250,
,1,1,00000808,Badee al Oud Sublime Lattafa  (Exhibido),,CITRICO,LATTAFA,250,
,1,1,00000809,Art of Nature II Lattafa  (Exhibido),,AMADERADO,LATTAFA,250,
,1,1,00000810,Liquid Burn French Avenue  (Exhibido),,AMADERADO,FRENCH AVENUE,250,
,2,2,00000811,His Confession Lattafa  (Exhibido),,AMADERADO,LATTAFA,250,
,2,2,00000812,Al Qiam Gold Lattafa  (Exhibido),,CITRICO,LATTAFA,250,
,1,1,00000813,Asad Bourbon Lattafa (Exhibido),,AMADERADO,LATTAFA,250,
,1,1,00000814,Odyssey Mega Man Armaf (Exhibido),,CITRICO,ARMAF,250,
,1,1,00000815,Armaf Oddysey Spectra Rainbow Edp  (Exhibido),,CITRICO,ARMAF,250,
,1,1,00000816,Wazeer Lattafa  (Exhibido),,CITRICO,LATTAFA,250,
,1,1,00000817,Safeer Al Noble Edp Lattafa  (Exhibido),,CITRICO,LATTAFA,250,
,1,2,00000818,Ameerat Al Arab Asdaaf  (Exhibido),,CITRICO,LATTAFA,250,
,1,1,00000819,Ard Al Zaafaran Sufa  (Exhibido),,DULCE,ARD AL ZAAFARAN,250,
,1,1,00000820,Club de Nuit Intense Man Armaf  (Exhibido),,CITRICO,ARMAF,250,
,1,1,00000821,Grandeur Instinct Noir  (Exhibido),,DULCE,GRANDEUR,250,
,1,1,00000822,Mashrabya Lattafa  (Exhibido),,DULCE,LATTAFA,250,
,1,1,00000823,Al Haramain Amber Oud Tabacco Edition Eau de Parfum (Exhibido),,AMADERADO,AL HARAMAIN,250,
,1,1,00000824,Satwa Ard al Zaafaran (Exhibido),,CITRICO,ARD AL ZAAFARAN,250,
,1,1,00000825,Lattafa Confidencial Private Gold (Exhibido),,DULCE,LATTAFA,250,
,1,1,00000826,Al Nashama Lattafa (Exhibido),,AMADERADO,LATTAFA,250,
,1,1,00000827,Lattafa Najdia Intense Eau de Parfum (Exhibido),,AMADERADO,LATTAFA,250,
,1,1,00000828,Chemystery Ajmal (Exhibido),,CITRICO,AJMAL,250,
,1,1,00002382,Left Ponit T-shirt S25-1587 Pearl White - Size L,,T-SHIRT,LEFT PONIT,350,
,1,1,00002387,Left Ponit T-shirt S24-1669 Black - Size L,,T-SHIRT,LEFT PONIT,350,
,1,1,00002393,Left Ponit T-shirt S24-1579 White - Size XL,,T-SHIRT,LEFT PONIT,350,
,1,1,16000028,Fear of God Essentials Track Pants Olive - Size XS,STREETWEAR LUJOSO,PANTALON BUZO,ESSENTIALS,750,
,1,1,10005025,AL - Marc Jacobs Womens Bag  Purple,DISEÑADOR,Cartera,Marc Jacobs,1400,
,1,,PACK0100,Hanes Boxer Fluoryell Pack x 2 - Size M - Color verde neon,,BOXER,SUPREME,199,
,1,1,00001713,FC Barcelona x Travis Scott - Size XL -  Color Guinda Azul,STREETWEAR LUJOSO,CAMISETA,Nike x Travis Scott,1599,
,0,,00006142,Supreme Monogram Double Knee Denim Painter Pants BLACK New with Tags - Size 32,,PANTALON JEANS,SUPREME,1799,
,1,1,00004432,Vale Forever Carver Worker Jacket Dest/Midrinse - Size L,STREETWEAR LUJOSO,CASACA JEANS,VALLEY FOREVER,1499,
,1,1,00004433,Vale Forever Carver Worker Jacket Dest/Midrinse - Size XL,STREETWEAR LUJOSO,CASACA JEANS,VALLEY FOREVER,1499,
,1,1,00002396,Supreme Floral Soccer Jersey White - Size M,STREETWEAR LUJOSO,JERSEY,SUPREME,1799,
,1,1,00000247,Amiri Core Logo Trucker Hat Black - Regulable,DISEÑADOR,GORRA REGULABLE CURVA,AMIRI,1299,
,1,1,00000248,Amiri Ma Logo Trucker Hat Black/Blue - Regulable,DISEÑADOR,GORRA REGULABLE CURVA,AMIRI,1299,
,1,1,11000042,DM - Travis Scott Cactus Jack x Nike T-Rexx Glow In The Dark Tee Black - Size L,STREETWEAR LUJOSO,T-SHIRT,Nike x Travis Scott,749,
,1,1,11000046,DM - Bola Travis Scott Cactus Jack Smiley Glow In The Dark Basketball,ACCESORIO,PELOTA,TRAVIS SCOTT,,
,3,3,16000037,JAM - Supreme/Hanes Crew Socks Black Pack x 4,ACCESORIO,MEDIAS,SUPREME,399,
,2,,16000036,JAM - Supreme/Hanes Crew Socks White Pack x 4,ACCESORIO,MEDIAS,SUPREME,399,
,1,1,PACK0304,Hanes Crew Socks White - Talla S - Color Gris 4 pack,,MEDIAS,SUPREME,399,
,1,,00010227,Off White Out Of Office Graffiti Black White -  43,,OUT OF OFFICE,OFF WHITE,,
,1,,00010801,Off White Be Right Blue White - 40 IT,,BE RIGHT,OFF WHITE,,
,1,,00051365,Jordan 4 Fight Club - 42.5 (9),,JORDAN 4,NIKE,,
,10,,00000309,Kit  de Limpieza Premium,,LIMPIEZA,TABAS & CARTERAS,,
,1,1,16000029,JAM - Off White Socks Black,ACCESORIO,MEDIAS,SUPREME,500,
,1,1,16000030,JAM - Tarjetero Burberry Black,DISEÑADOR,BILLETERA,BURBERRY,749,
,1,1,16000031,JAM - Palm Angels Logo Palm Angels Black,DISEÑADOR,BEANIE,PALM ANGELS,600,
,1,1,16000032,JAM - Supreme Blue Towel,STREETWEAR LUJOSO,TOALLA,SUPREME,600,
,1,1,16000033,JAM - Backpack (SS20) Dark Red,ACCESORIO,MOCHILA,SUPREME,1499,
,1,1,16000034,JAM - Canvas Backpack Black,ACCESORIO,MOCHILA,SUPREME,1399,
,1,1,16000035,JAM - Supreme/Heller Bowls (Set of 6),ACCESORIO,BOWLS,SUPREME,800,
,2,2,16000039,JAM - Supreme/Hanes Crew Socks Red Pack x 4,ACCESORIO,MEDIAS,SUPREME,399,
,1,,16000040,JAM - Supreme/Hanes Boxer Briefs Fluorescent Yellow Pack x 2 - Size M,,BOXER,SUPREME,399,
,1,,16000041,JAM - Supreme/Hanes Boxer Briefs White Pack x 4 - Size XL,,BOXER,SUPREME,399,
,1,1,16000048,JAM - FOG Hoodie Stresh Limo - Talla XL - Color Negro Verdoso,STREETWEAR LUJOSO,HOODIE,ESSENTIALS,750,
,1,,16000045,JAM - FOG Hoodie Light Oatmeal - Talla M - Color Plomo Claro,,HOODIE,ESSENTIALS,750,
,1,1,16000047,JAM- FOG Hoodie Light Oatmeal - Talla XL - Color Plomo Claro,STREETWEAR LUJOSO,HOODIE,ESSENTIALS,750,
,1,1,16000046,JAM - FOG Hoodie Light Oatmeal - Talla L - Color Plomo Claro,STREETWEAR LUJOSO,HOODIE,ESSENTIALS,750,
,1,1,17000016,REX - Rexotic Zignature Denim Black Acid Wash - Size 34,STREETWEAR LUJOSO,PANTALO JEANS,Rexotic,650,
,1,1,00000249,Amiri Arts District Trucker Hat Stone Grey,DISEÑADOR,GORRA REGULABLE CURVA,AMIRI,1299,
,1,1,00000250,Amiri MA Logo Trucker Cap Pond Blue/White,DISEÑADOR,GORRA REGULABLE CURVA,AMIRI,1299,
,1,1,00000251,Amiri DJ Premier Record Canvas Hat Black,DISEÑADOR,GORRA REGULABLE CURVA,AMIRI,1299,
,1,1,00000252,Vale Forever Leonard Snapper Hat Black,STREETWEAR LUJOSO,GORRA REGULABLE CURVA,VALLEY FOREVER,550,
,1,1,12000030,JR - Travis Scott x FC Barcelona 1899 Distressed Hat Multicolor,STREETWEAR LUJOSO,GORRA REGULABLE CURVA,Travis Scott x FC Barcelona,589,
,1,,19000091,Goods Conjunto Goodsland - Size M,,Conjunto,GOODS,,
,1,,19000215,Goods Short Dance Rous White/Pink - Size S,,SHORT,GOODS,,
,1,,00002401,Travis Scott South America Skitzo T-Shirt White - Size M,,T-SHIRT,TRAVIS SCOTT,499,
,1,1,00005126,Eric Emanuel EE Basic/Core Short Grey Bark/Blue - Size S,STREETWEAR LUJOSO,SHORT,Eric Emanuel,789,
,1,1,00005137,Eric Emanuel EE Basic/Core Short EE Bolt Black - Size M,STREETWEAR LUJOSO,SHORT,Eric Emanuel,799,
,1,1,PACK0302,Hanes Crew Socks Black - Talla S - Color Black 4 Pack,ACCESORIOS,MEDIAS,SUPREME,399,
,2,2,PACK0303,Hanes Crew Socks White - Talla S - Color White 4 Pack,ACCESORIOS,MEDIAS,SUPREME,399,
,1,1,PACK0101,Hanes Boxer Brief White Pack x 4 - Talla S - Color Blanco 4 Pack,ACCESORIOS,BOXER,SUPREME,399,
,1,1,PACK0102,Hanes Boxer Brief White Pack x 4 - Talla M - Color Blanco 4 Pack,ACCESORIOS,BOXER,SUPREME,399,
,1,1,PACK0103,Hanes Boxer Brief White Pack x 4 - Talla L - Color Blanco 4 Pack,ACCESORIOS,BOXER,SUPREME,399,
,1,1,PACK0105,Hanes Boxer Briefs Black Pack x 4 - Talla S - Color Negro,ACCESORIOS,BOXER,SUPREME,399,
,1,1,PACK0106,Hanes Boxer Briefs Black Pack x 4 - Talla M- Color Negro,ACCESORIOS,BOXER,SUPREME,399,
,1,1,PACK0107,Hanes Boxer Briefs Black Pack x 4 - Talla L - Color Negro,ACCESORIOS,BOXER,SUPREME,399,
,1,1,PACK0108,Hanes Boxer Briefs Black Pack x 4 - Talla XL - Color Negro,ACCESORIOS,BOXER,SUPREME,399,
,1,1,11000047,Supreme Too Deadly Hooded Sweatshirt Blue - Size L,STREETWEAR LUJOSO,HOODIE,SUPREME,750,
,1,1,00002405,T shirt Vale Forever Bling White - Size S,STREETWEAR LUJOSO,T-SHIRT,VALLEY FOREVER,899,
,1,1,00002408,T shirt Vale Forever Bling White - Size XL,STREETWEAR LUJOSO,T-SHIRT,VALLEY FOREVER,899,
,1,1,00002410,Crewneck Vale Forever Dragon Thermal - Size S,STREETWEAR LUJOSO,T-SHIRT MANGA LARGA,VALLEY FOREVER,899,
,1,,KYIJWHB9,Crewneck Vale Forever Dragon Thermal - Size L,,T-SHIRT MANGA LARGA,VALLEY FOREVER,899,
,1,1,11000048,DM - Adidas x BAPE Relaxed Fit Track Camo Shark Full Zip Hoodie - Size M,STREETWEAR LUJOSO,ZIP HOODIE,ADIDAS X BAPE,750,