IMAGEN,"Stock
anterior",STOCK ACTUAL,Código,Nombre,CATEGORIA,Sub categoria,Marca,PRECIO,
,1,1,00002161,Dog Tag Big Tee Black - Size M - Color negro,STREETWEAR LUJOSO,T-SHIRT,VALLEY FOREVER,799,
,1,1,00002162,Dog Tag Big Tee Black - Size L - Color negro,STREETWEAR LUJOSO,T-SHIRT,VALLEY FOREVER,799,
,0,,00002165,Fever Bling Black - Size S - Color negro pedreria fucsia,,T-SHIRT,VALLEY FOREVER,899,
,0,,00002166,Fever Bling Black - Size M - Color negro pedreria fucsia,STREETWEAR LUJOSO,T-SHIRT,VALLEY FOREVER,899,
,1,1,00002167,Vale Forever Fever Bling Black - Size L - Color negro pedreria fucsia,STREETWEAR LUJOSO,T-SHIRT,VALLEY FOREVER,899,
,1,1,00002170,Vale Forever Camel Bling Big Tee Black - Size S - Color negro acid wash pedreria negro,STREETWEAR LUJOSO,T-SHIRT,VALLEY FOREVER,899,
,0,,00002171,Camel Bling Big Tee Black - Size M - Color negro acid wash pedreria negro,,T-SHIRT,VALLEY FOREVER,899,
,0,,00002172,Camel Bling Big Tee Black - Size L - Color negro acid wash pedreria negro,,T-SHIRT,VALLEY FOREVER,899,
,1,,00002175,Vale Forever Wraith Bling Tee White - Size S - Color blanco pedreria blanco,,T-SHIRT,VALLEY FOREVER,899,
,-1,,00002177,Wraith Bling Tee White - Size L - Color blanco pedreria blanco,,T-SHIRT,VALLEY FOREVER,899,
,1,1,00002180,Nyc Invasion Big Tee Black - Size S - Color negro,STREETWEAR LUJOSO,T-SHIRT,VALLEY FOREVER,799,
,1,1,00002181,Nyc Invasion Big Tee Black - Size M - Color negro,STREETWEAR LUJOSO,T-SHIRT,VALLEY FOREVER,799,
,1,1,00002185,Vale Forever Motocroxxx Tee Black - Size S - Color negro,STREETWEAR LUJOSO,T-SHIRT,VALLEY FOREVER,799,
,1,1,00002186,Motocroxxx Tee Black - Size M - Color negro,STREETWEAR LUJOSO,T-SHIRT,VALLEY FOREVER,799,
,1,1,00002190,Guard Dog Big Tee Black - Size S -Color negro,STREETWEAR LUJOSO,T-SHIRT,VALLEY FOREVER,799,
,1,1,00002191,Valley Forever Guard Dog Big Tee Black - Size M -Color negro,STREETWEAR LUJOSO,T-SHIRT,VALLEY FOREVER,799,
,1,1,00002192,Guard Dog Big Tee Black - Size L -Color negro,STREETWEAR LUJOSO,T-SHIRT,VALLEY FOREVER,799,
,1,1,00002197,Chrome Hearts Purple Neck Letter White Long Sleeve Shirt - Size L - Color blanco con cuello morado,DISEÑADOR,T-SHIRT MANGA LARGA,Chrome Hearts,1899,
,0,1,00002200,Uniqlo x CPFM Spongebob Squarepants UT Graphic - Size S - Color blanco,STREETWEAR LUJOSO,T-SHIRT,UNIQLO,300,
,1,1,00002203,Uniqlo x CPFM Spongebob Squarepants UT Graphic - Size XL - Color blanco,STREETWEAR LUJOSO,T-SHIRT,UNIQLO,300,
,1,,12000023,JR - Denim Mini Shoulder Bag Realtree AP Camo,,MORRAL,SUPREME,550,
,2,1,00000110,Supreme Contrast S Mesh Back 6-Panel Green - FW25 - US - Regulable malla - Color verde,STREETWEAR LUJOSO,GORRA REGULABLE CURVA,SUPREME,550,RETIRO POR MARKETING               
,0,,00000227,AMIRI Jazz Wolf Trucker Hat black - Regulable Malla - Color negro,DISEÑADOR,GORRA REGULABLE CURVA,AMIRI,1399,
,0,,00000112,Buy Chrome Hearts FUCK Hollywood Trucker Hat Black/White - Regulable plano malla - Color negro,,GORRA REGULABLE PLANA,Chrome Hearts,2999,
,1,1,00000113,Supreme Fox Racing 6-Panel Blue - Regulable curva - Color azul,STREETWEAR LUJOSO,GORRA REGULABLE CURVA,SUPREME X FOX,550,
,1,1,00000114,Supreme Denim Camp Cap Washed Indigo - Regulable plana - Color jeans lavado,STREETWEAR LUJOSO,GORRA REGULABLE CURVA,SUPREME,550,
,1,,00000115,Rhude x Automobili Lamborghini 63 Hat 'Navy/Brown - Regulable plana - Color azul marron,,GORRA REGULABLE PLANA,RHUDE,1199,
,0,,00000116,Supreme Bones Box Logo New Era 59Fifty Fitted Hat - Talla 7 1/2 - Color plomo huesitos,,GORRA CERRADA PLANA,SUPREME X NEW ERA,550,
,0,1,00002206,Supreme Wu-Tang Clan RZA Tee Yellow - Size M - Color amarillo,,T-SHIRT,SUPREME,550,
,1,1,00002212,Supreme x Frank Frazetta Destruction Green - Size L - Color verde palta,STREETWEAR LUJOSO,T-SHIRT,SUPREME,550,
,1,1,00002216,Supreme Camacho Tee Grey - Size M - Color gris,STREETWEAR LUJOSO,T-SHIRT,SUPREME,550,
,0,,00002227,Supreme The Exorcist Mother White - Size L - Color blanco,,T-SHIRT MANGA LARGA,SUPREME,550,
,1,1,00002228,Supreme The Exorcist Mother White - Size XL - Color blanco,STREETWEAR LUJOSO,T-SHIRT MANGA LARGA,SUPREME,550,
,1,1,00002232,Supreme The Exorcist Mother Pink - Size L - Color rosado,STREETWEAR LUJOSO,T-SHIRT MANGA LARGA,SUPREME,550,
,1,1,00002233,Supreme The Exorcist Mother Pink - Size XL - Color rosado,STREETWEAR LUJOSO,T-SHIRT MANGA LARGA,SUPREME,550,
,1,1,00002237,Supreme The Exorcist Puke Tee  Sky Blue - Size L - Color celeste,STREETWEAR LUJOSO,T-SHIRT,SUPREME,550,
,1,,00002243,Supreme The Exorcist Puke Tee  Brown - Size XL - Color celeste,,T-SHIRT,SUPREME,550,
,1,1,00002246,Supreme Skull Tee Black - Size M - Color negro,STREETWEAR LUJOSO,T-SHIRT,SUPREME,550,
,1,1,00002252,Supreme Skull Tee Red - Size L - Color rojo,STREETWEAR LUJOSO,T-SHIRT,SUPREME,550,
,1,1,00002253,Supreme Skull Tee Red - Size XL - Color rojo,STREETWEAR LUJOSO,T-SHIRT,SUPREME,550,
,1,1,00002256,Supreme Washed Tag Short-Sleeve Top Neon Green - Size M - Color verde neon,STREETWEAR LUJOSO,T-SHIRT,SUPREME,550,
,0,,00002262,Supreme Washed Tag Short-Sleeve Top White - Size M - Color blanco,,T-SHIRT,SUPREME,550,
,1,1,00002265,Supreme Fuckin Blowout Tee White - Size S - Color blanco,STREETWEAR LUJOSO,T-SHIRT,SUPREME,550,
,1,,00002273,Supreme Fuckin Blowout Tee Pink - Size XL - Color rosado,STREETWEAR LUJOSO,T-SHIRT,SUPREME,550,
,0,,00004366,Supreme Stars Studded Hooded Sweatshirt Dusty Gold - Size M - Color mostaza,,HOODIE,SUPREME,1500,
,1,1,00004372,Supreme Crest Applique Half Zip Pullover Light Blue - Size L - Color celeste,STREETWEAR LUJOSO,HOODIE,SUPREME,1250,
,1,1,00004377,Supreme Wings Zip Up Hooded Sweatshirt Black - Size L - Color negro,STREETWEAR LUJOSO,HOODIE,SUPREME,1800,
,1,1,00004381,Supreme The Exorcist Hooded Sweatshirt Black - Size M - Color negro,STREETWEAR LUJOSO,HOODIE,SUPREME,1500,
,1,1,00004387,Supreme Box Hooded Sweatshirt Dark Red - Size L - Color rojo,STREETWEAR LUJOSO,HOODIE,SUPREME,1300,
,1,1,00004392,Supreme Classic Logo Miami Shop Hooded Sweatshirt Pink - Size L - Color fucsia,STREETWEAR LUJOSO,HOODIE,SUPREME,1500,
,1,,00005085,Fear Of God Essentials Relaxed Short Wheat - Size S,,SHORT,ESSENTIALS,550,
,1,1,00004396,Vale Forever Carver Zip Up Black - Size M,STREETWEAR LUJOSO,HOODIE,VALLEY FOREVER,1499,
,1,1,00004401,Vale Forever Insignia Crewneck Dirty/White - Size M,STREETWEAR LUJOSO,HOODIE,VALLEY FOREVER,1099,
,2,2,00007055,Fear Of God (cuffless jogger) Dark Oatmeal - Size S,STREETWEAR LUJOSO,PANTALON BUZO,ESSENTIALS,750,
,1,1,00007056,Fear Of God (cuffless jogger) Dark Oatmeal - Size M,STREETWEAR LUJOSO,PANTALON BUZO,ESSENTIALS,750,
,2,2,00007057,Fear Of God (cuffless jogger) Dark Oatmeal - Size L,STREETWEAR LUJOSO,PANTALON BUZO,ESSENTIALS,750,
,1,1,00007062,Fear Of God (cuffless jogger) Light Oatmeal - Size L,STREETWEAR LUJOSO,PANTALON BUZO,ESSENTIALS,750,
,1,1,00007063,Fear Of God (cuffless jogger) Light Oatmeal - Size XL,STREETWEAR LUJOSO,PANTALON BUZO,ESSENTIALS,750,
,1,1,00007065,Fear Of God (cuffless jogger) Stretch Limo - Size XS,STREETWEAR LUJOSO,PANTALON BUZO,ESSENTIALS,750,
,1,1,00007066,Fear Of God (cuffless jogger) Stretch Limo - Size S,STREETWEAR LUJOSO,PANTALON BUZO,ESSENTIALS,750,
,2,2,00007067,Fear Of God (cuffless jogger) Stretch Limo - Size M,STREETWEAR LUJOSO,PANTALON BUZO,ESSENTIALS,750,
,1,1,00007070,Fear Of God (cuffless jogger) Iron - Size S,STREETWEAR LUJOSO,PANTALON BUZO,ESSENTIALS,750,
,1,1,00007072,Fear Of God (cuffless jogger) Iron - Size L,STREETWEAR LUJOSO,PANTALON BUZO,ESSENTIALS,750,
,1,1,00004110,Essentials Fog Hoodie Taupe - Size S,STREETWEAR LUJOSO,HOODIE,ESSENTIALS,750,
,1,1,00004152,Essentials Fog Hoodie Off Black - Size L,STREETWEAR LUJOSO,HOODIE,ESSENTIALS,750,
,1,1,00004088,Fog Hoodie Dark Oatmeal - Size XL,STREETWEAR LUJOSO,HOODIE,ESSENTIALS,750,
,1,1,10000000,RT - Supreme Y's by Yohji Yamamoto Baggy Jean - Size 32,STREETWEAR LUJOSO,PANTALON,SUPREME,1800,
,1,,10000001,RT - Supreme Black Reflective Double Knee Pants - Size 34,,PANTALON,SUPREME,1800,
,1,1,10000002,RT - Godspeed Goldie Racer Black - Size L,STREETWEAR LUJOSO,T-SHIRT,GOODSPEED,1200,
,1,1,10000003,RT - Godspeed Podium Dreams Stone - Size L,STREETWEAR LUJOSO,T-SHIRT,GOODSPEED,1200,
,1,1,10000004,RT - Martyrdom Arrow Skate Embroidered Graphic Black - Size XL,DISEÑADOR,T-SHIRT,OFF WHITE,2200,
,1,1,10000005,RT - Rhude Cross Logo Zip Up Hoodie Vintage Black - Size XL,DISEÑADOR,ZIP UP HOODIE,RHUDE,2500,
,1,1,10005000,AL - 00 Check Stripe Knitted Sweater Orange - Size S - Color Naranja,DISEÑADOR,SUETER,OFF WHITE,1800,
,1,,10005001,AL - 00 Check Stripe Knitted Sweater Orange - Size M - Color Naranja,,SUETER,OFF WHITE,,
,1,,10005002,AL - 00 Check Stripe Knitted Sweater Orange - Size L - Color Naranja,,SUETER,OFF WHITE,,
,1,,00002275,Off White Bacchus Skate Black Collage - Size S - Color Plomo Acid Wash,,T-SHIRT,OFF WHITE,1800,
,1,,10005004,AL - Ma Quad Straight - Leg Distressed Jeans Amiri - Size 32,,PANTALON,OFF WHITE,2200,
,0,,11000000,DM - Yeezy Gap Engineered by Balenciaga Dove 3/4 Sleeve Tee - Size S,,T-SHIRT,GAP X BALENCIAGA,500,
,2,1,11000001,DM - Yeezy Gap Engineered by Balenciaga Dove 3/4 Sleeve Tee - Size M,DISEÑADOR,T-SHIRT,GAP X BALENCIAGA,500,
,1,1,11000002,DM - Stars Studded Hooded Sweatshirt Navy - Size L,STREETWEAR LUJOSO,HOODIE,SUPREME,1500,
,1,1,11000003,DM - Stars Studded Hooded Sweatshirt Black - Size M,STREETWEAR LUJOSO,HOODIE,SUPREME,1500,
,0,,11000004,DM - Stars Studded Hooded Sweatshirt Black - Size L,,HOODIE,SUPREME,1500,
,1,1,11000005,DM - Supreme Chicago White Sox Stadium Jacket Black - Size L,STREETWEAR LUJOSO,JACKET,SUPREME,2400,
,1,1,11000006,DM - Supreme Football Zip Up Hooded Sweatshirt White - Size L,STREETWEAR LUJOSO,ZIP UP HOODIE,SUPREME,1600,
,1,1,11000007,DM - Supreme Football Zip Up Hooded Sweatshirt Black - Size L,STREETWEAR LUJOSO,ZIP UP HOODIE,SUPREME,1600,
,2,1,11000008,DM - Supreme MLB Teams Sox Tee Black - Size L,STREETWEAR LUJOSO,T-SHIRT,SUPREME,550,NO HAY REGISTRO DE LA VENTA 
,1,,11000009,DM - Supreme Snowman Tee Brown - Size M,,T-SHIRT,SUPREME,550,
,1,1,11000010,DM - Supreme Snowman Tee Brown - Size L,STREETWEAR LUJOSO,T-SHIRT,SUPREME,550,
,1,,11000011,DM - Vale Forever Carver Zip Up Black -Size XXL,,ZIP UP HOODIE,SUPREME,1500,
,0,,11000027,DM - Box Logo New Era x Balaclava Black - 7 1/4,,GORRA CERRADA PLANA,SUPREME X NEW ERA,650,
,1,1,11000028,DM - Box Logo New Era x Balaclava Black - 7 3/8,STREETWEAR LUJOSO,GORRA CERRADA PLANA,SUPREME X NEW ERA,650,
,0,,11000029,DM - Jacquard Logos Denim Camp Cap Blue - Regulable,,GORRA REGULABLE PLANA,SUPREME,650,
,1,1,11000030,DM - Supreme Studded Mesh Back 5-Panel Navy - Regulable malla pedreria,STREETWEAR LUJOSO,GORRA REGULABLE PLANA,SUPREME,650,
,2,1,11000031,DM - Supreme/MLB Teams Box Logo New Era White Sox Black - 7 3/8,STREETWEAR LUJOSO,GORRA CERRADA PLANA,SUPREME X NEW ERA,600,
,1,1,11000032,DM - Bones Box Logo New Era Navy - 7 3/8 - Cerrada plana,STREETWEAR LUJOSO,GORRA CERRADA PLANA,SUPREME X NEW ERA,550,
,1,1,11000033,DM - Bones Box Logo New Era Grey - 7 3/8 - Cerrada plana,STREETWEAR LUJOSO,GORRA CERRADA PLANA,SUPREME X NEW ERA,550,
,0,,11000034,DM - Supreme/Hanes Boxer Briefs Black - Size L,,BOXER,SUPREME,,
,2,2,11000035,DM - Supreme New Era Tribal S Logo Beanie Navy azulado,STREETWEAR LUJOSO,BEANIE,SUPREME,550,
,2,2,11000036,DM - Supreme New Era Tribal S Logo Beanie Navy Black,STREETWEAR LUJOSO,BEANIE,SUPREME,550,
,1,,11000037,DM - Supreme Mini Utility Bag,,MORRAL,SUPREME,350,
,3,3,11000038,DM - LaBubu Pop Mart The Monsters Big Into Energy,ACCESORIOS,MUñECO,POP MART,350,
,1,,12000001,JR - Air Jordan 1 High OG Chicago - 35 (3Y) - Color Rojo Blanco,,JORDAN 1 HIGH,NIKE,,
,1,1,12000000,JR - Vale Forever CHAIN PAINTERS Black Focalizado - Size 32,STREETWEAR LUJOSO,PANTALON,VALLEY FOREVER,1499,
,1,,12000021,JR - Mixed Emotion Paisley Denim Shorts - Size 32,,SHORT,MIXED EMOTION,550,
,1,,12000024,JR - AllSaints Redact Oversized Embroidered Black - Size L,,T-SHIRT,ALLSAINTS,2800,
,0,,12000025,JR - UNDERGROUND AllSaints Oversized Black - Size M,,T-SHIRT,ALLSAINTS,2800,
,0,,12000026,JR- Supreme Breast Cancer Awareness Football Jersey - Size L,,JERSEY,SUPREME,1750,
,1,1,12000027,JR- Jacket Pleasures Black - Size S - Cuero,STREETWEAR LUJOSO,JACKET,PLEASURES,750,
,1,,00002278,Vale Forever Vs Racing Long-Sleeve Black/White - Size XL,,T-SHIRT MANGA LARGA,VALLEY FOREVER,799,
,1,1,00002282,Vale Forever Jesus Hardy Long-Sleeve White - Size L,STREETWEAR LUJOSO,T-SHIRT MANGA LARGA,VALLEY FOREVER,799,
,1,1,00004007,Vale Forever Vale Star Zip Up Dest/Black/Tan - Size L,STREETWEAR LUJOSO,ZIP UP HOODIE,VALLEY FOREVER,1500,
,0,,00004009,Vale Forever Vale Star Zip Up Dest/Black/Tan - Size XXL,,ZIP UP HOODIE,VALLEY FOREVER,1500,
,1,1,00004407,Vale Forever Venus Zip Up Pink- Size L- Pedreria,STREETWEAR LUJOSO,ZIP UP HOODIE,VALLEY FOREVER,1550,
,1,1,00004414,Vale Forever Sea Cluster Zip Up Hoodie Blue - Size XXL- Pedreria,STREETWEAR LUJOSO,ZIP UP HOODIE,VALLEY FOREVER,1550,
,1,1,00005091,Vale Valley Skittles Stones Shorts Blue - Size 30,STREETWEAR LUJOSO,SHORT,VALLEY FOREVER,1499,
,1,1,2279,Vale Forever Vs Racing Long-Sleeve 'Black/White'- Size XXL,STREETWEAR LUJOSO,T-SHIRT MANGA LARGA,VALLEY FOREVER,799,
,1,1,00004083,VALLEY NOISE ZIP UP DARK GREY - Talla XL - Color Plomo,STREETWEAR LUJOSO,ZIP UP HOODIE,VALLEY FOREVER,1459,
,1,,00004077,VALLEY SKYLINE ZIP UP HOODIE MULTICOLOR - Talla L - Color Azul,,ZIP UP HOODIE,VALLEY FOREVER,1399,
,1,1,00004233,Valley Hoodie Stone Zip Up Black Crystals - Talla XL - Color gris acid wash pedreria,STREETWEAR LUJOSO,ZIP UP HOODIE,VALLEY FOREVER,1700,
,1,1,00005066,Vale Forever Shorts de mezclilla con perlas Beige Vintage - Size 30,STREETWEAR LUJOSO,SHORT,VALLEY FOREVER,1499,
,1,1,00005067,Vale Forever Shorts de mezclilla con perlas Beige Vintage - Size 32,STREETWEAR LUJOSO,SHORT,VALLEY FOREVER,1499,
,1,1,00005068,Vale Forever Shorts de mezclilla con perlas Beige Vintage - Size 34,STREETWEAR LUJOSO,SHORT,VALLEY FOREVER,1499,
,0,,00005092,Vale Forever Skittles Jorts Black/Cream - Size 32,,SHORT,VALLEY FOREVER,1499,
,0,,00005101,Vale Forever Iced Out Jorts Mid Blue - Size 30,,SHORT,VALLEY FOREVER,1499,
,0,,00005102,Vale Forever Iced Out Jorts Mid Blue - Size 32,,SHORT,VALLEY FOREVER,1499,
,1,1,00005104,Vale Forever Forever Iced Out Jorts Mid Blue - Size 36,STREETWEAR LUJOSO,SHORT,VALLEY FOREVER,1499,
,1,1,00005106,Vale Forever Shorts de mezclilla con perlas Grey Acid Wash - Size 30,STREETWEAR LUJOSO,SHORT,VALLEY FOREVER,1499,
,0,,00005107,Vale Forever Shorts de mezclilla con perlas Grey Acid Wash - Size 32,,SHORT,VALLEY FOREVER,1499,
,1,1,00005108,Vale Forever Shorts de mezclilla con perlas Grey Acid Wash - Size 34,STREETWEAR LUJOSO,SHORT,VALLEY FOREVER,1499,
,2,2,00005111,Vale Forever Siren Jorts Black - Size 30 - Aperlado plata,STREETWEAR LUJOSO,SHORT,VALLEY FOREVER,1499,
,1,,00010145,Off White Out Of Office Black White - 42 IT,,OUT OF OFFICE,OFF WHITE,,
,1,,00010651,Off-White Out of Office Triple Black - 40,,OUT OF OFFICE,OFF WHITE,,
,1,,00010653,Off-White Out of Office Triple Black - 41,,OUT OF OFFICE,OFF WHITE,,
,1,,00010655,Off-White Out of Office Triple Black - 42,,OUT OF OFFICE,OFF WHITE,,
,1,,00010663,Off-White Out of Office Red White - 41,,OUT OF OFFICE,OFF WHITE,,
,0,,00010673,Off-White Out of Office White Dark Blue Light - 41,,OUT OF OFFICE,OFF WHITE,,
,1,,00010683,Off-White Out of Office Grey White - 41,,OUT OF OFFICE,OFF WHITE,,
,1,,00010693,Off-White Out of Office White Grey Navy - 41,,OUT OF OFFICE,OFF WHITE,,
,0,,00002281,Rhude Rhinestone Hunting Dog Tee Vintage Black - Size M - Pedreria,,T-SHIRT,RHUDE,1599,
,0,,00002285,Rhude Bordeaux Wine Tee - Vintage White - Size S,,T-SHIRT,RHUDE,1499,
,1,1,00002292,Rhude Script Crest Black - Size L,DISEÑADOR,T-SHIRT,RHUDE,1499,
,1,1,00002303,Rhude Shocker Tee Vintage Black Vintage - Size XL,DISEÑADOR,T-SHIRT,RHUDE,1499,
,0,,00002310,Rhude Chevron Tee Vintage Black -  Size S,,T-SHIRT,RHUDE,1499,
,0,,00000117,Rhude Cellier Trucker Hat en color Navy Cream - Regulable,,GORRA REGULABLE PLANA,RHUDE,750,
,3,1,00004087,FOG HOODIE DARK OATMEAL - Size L - Color Plomo Melange,STREETWEAR LUJOSO,HOODIE,ESSENTIALS,750,
,2,1,00004090,FOG HOODIE STRECH LIMO - Size S - Color Negro Verdoso,STREETWEAR LUJOSO,HOODIE,ESSENTIALS,750,
,1,1,00002307,Casa Blanca LArche De Tennis Short Sleeve T-Shirt White - Size L,DISEÑADOR,T-SHIRT,CASA BLANCA,1599,
,1,1,11000041,DM - Cactus Jack x Nike Smiley Glow In The Dark Hoodie - Size L,STREETWEAR LUJOSO,HOODIE,Nike x Travis Scott,1399,
,1,1,00005115,Eric Emanuel EE Basic Short Black Logo White - Size S,STREETWEAR LUJOSO,SHORT,Eric Emanuel,750,
,1,1,00002316,Off-White BW Saint Matthew Over Short-Sleeve T-Shirt Black/Grey - Size M,DISEÑADOR,T-SHIRT,OFF WHITE,1499,
,1,1,00002323,Off-White Marker Short-Sleeve Slim Tee Black/Blue - Size XL,DISEÑADOR,T-SHIRT,OFF WHITE,1499,
,0,1,00002329,Off-White Vibe Arrow Skate Short-Sleeve Tee 'White/Black' - Size XXL,,T-SHIRT,OFF WHITE,1499,
,1,,00002333,Off White Caravaggio Angel - Size XL,,T-SHIRT,OFF WHITE,1499,
,1,1,00002337,Off White alien-print cotton t-shirt - Size L,DISEÑADOR,T-SHIRT,OFF WHITE,1499,
,1,2,00002338,Off White alien-print cotton t-shirt - Size XL,DISEÑADOR,T-SHIRT,OFF WHITE,1499,
,1,1,00001962,Off White Cartoon Arrow_Slim S/S Tee Black - Size L,DISEÑADOR,T-SHIRT,OFF WHITE,1800,
,1,,00004405,OFF-WHITE C/O Chicago Bulls Varsity Black Jacket - Size S,,JACKET,OFF WHITE,5800,
,1,1,00004410,Off White Logic Patch Varsity Jacket - Size S (48),DISEÑADOR,JACKET,OFF WHITE,5800,
,1,1,00004416,Off-White Barrel Leather Varsity Jacket Green/Orange - Size M (fit S),DISEÑADOR,JACKET,OFF WHITE,5800,
,1,1,00005064,Off-White Caravaggio Arrows Mesh Shorts Black - Size XXL,DISEÑADOR,SHORT,OFF WHITE,1500,
,1,1,5121,Off White Cream Terry Cotton Bowling Shorts - Size  M (48),DISEÑADOR,SHORT,OFF WHITE,1399,
,1,1,00006103,OFF-WHITE Diag Slim Fit Denim Jeans Black - Size 34,DISEÑADOR,PANTALON JEANS,OFF WHITE,1999,
,1,1,00006117,Off-White Single Arrow Slim Jeans Black/White - Size 33,DISEÑADOR,PANTALON JEANS,OFF WHITE,1999,
,1,1,00006122,Palm Angels Patterned Wide Leg Jeans Medium Blue - Size 33,DISEÑADOR,PANTALON JEANS,PALM ANGELS,1999,
,1,1,00006123,Palm Angels Patterned Wide Leg Jeans Medium Blue - Size 34,DISEÑADOR,PANTALON JEANS,PALM ANGELS,1999,
,1,1,00006127,Palms Angels Jacquard Straight5 PKT Light Blue - Size 33,DISEÑADOR,PANTALON JEANS,PALM ANGELS,1999,
,1,1,00006128,Palms Angels Jacquard Straight5 PKT Light Blue - Size 34,DISEÑADOR,PANTALON JEANS,PALM ANGELS,1999,
,1,1,00006133,Palm Angels Logo Patch Straight Jeans Black - Size 34,DISEÑADOR,PANTALON JEANS,PALM ANGELS,1999,
,1,1,00006138,Off White ARR Tapered Jeans - Size 34,DISEÑADOR,PANTALON JEANS,OFF WHITE,1999,
,1,1,00002107,Perforated Jersey Black - Talla L - Color negro,DISEÑADOR,JERSEY,OFF WHITE,1800,
,1,1,00002157,Vale Forever Gridiron Bling Tee Black - Size L - Color negro acid wash pedreria,DISEÑADOR,T-SHIRT,VALLEY FOREVER,899,
,1,1,00001807,Dollar Print Oversized In Cream - Size L,DISEÑADOR,T-SHIRT,PALM ANGELS,1399,
,1,1,00001828,Mini College Black Dark  Red - Size XL,DISEÑADOR,T-SHIRT,PALM ANGELS,1399,
,1,2,00001787,The Palm Back Black - Size L,DISEÑADOR,T-SHIRT,PALM ANGELS,1399,
,1,,G4LFO2U2,Burning Palm Over Black/Gold - Size M,DISEÑADOR,T-SHIRT,PALM ANGELS,,
,1,,475PLFV8,Logo Patch T-Shirt Navy Blue -  Size M,DISEÑADOR,T-SHIRT,PALM ANGELS,,
,1,1,00001773,Back Curved Logo Over Tee Black - Size XL,DISEÑADOR,T-SHIRT,PALM ANGELS,1399,
,1,1,00001767,Palm Angels Back Curved Logo Over Tee White - Size L,DISEÑADOR,T-SHIRT,PALM ANGELS,1399,
,1,1,00004186,Palm Angels Logo Flames Vint Crew Black Red - Size M - Color Negro Acid Wash,DISEÑADOR,Hoodie Crew Neck,PALM ANGELS,1999,
,1,1,00002222,Amiri Crystal Amiri Wings Tee Black - Size M,DISEÑADOR,T-SHIRT,AMIRI,1399,
,0,,00002342,Casa Blanca Championship Diamond Printed Black - Size L,DISEÑADOR,T-SHIRT,CASA BLANCA,1699,
,1,1,00002351,Off White Watercolor Arrow T-shirt - Size M,DISEÑADOR,T-SHIRT,OFF WHITE,1499,
,1,1,00002357,Off-White Hand Arrow Over T-Shirt White/Black - Size L,DISEÑADOR,T-SHIRT,OFF WHITE,1650,
,1,1,00002361,Essentials Fear Of God Heather Grey - Size M,STREETWEAR LUJOSO,T-SHIRT,ESSENTIALS,550,
,1,1,00002368,Essentials Fear Of God Timber T- Shirt - Size XL,STREETWEAR LUJOSO,T-SHIRT,ESSENTIALS,550,
,1,1,00003047,Fresco Arrow Popl Bowling White Multicolor - Size L (50),DISEÑADOR,CAMISA,OFF WHITE,1800,
,1,,00004422,Essentials Hoodie Dark Oatmeal - Size L,STREETWEAR LUJOSO,HOODIE,ESSENTIALS,750,
,1,,00002348,Casa Blanca Diamond Column Short Sleeve T-Shirt - Size XL,,T-SHIRT,CASA BLANCA,1499,
,1,,00000215,Palm Angels Classic Logo Beanie Black - Size S,,BEANIE,PALM ANGELS,499,
,6,6,17000000,REX - Gorra Rexotic Logo R Blue,STREETWEAR LUJOSO,GORRA REGULABLE PLANA,Rexotic,250,
,1,1,00000400,Palm Angels Sunglasses Hinkley Havana Dark - NO BOX,DISEÑADOR,GLASSES,PALM ANGELS,999,
,1,1,00000401,Palm Angels Sunglasses Sonoma Black Marble - NO BOX,DISEÑADOR,GLASSES,PALM ANGELS,999,
,3,3,00000402,Off White Sunglasses Greeley Havana Dark,DICEÑADOR,GLASSES,OFF WHITE,1500,
,1,1,00000403,Off White Sunglasses Leonardo Black,DICEÑADOR,GLASSES,OFF WHITE,1500,
,1,2,00000404,Off White Sunglasses Oregon White,DISEÑADOR,GLASSES,OFF WHITE,1500,
,1,1,00000405,Off White Sunglasses Pablo Square - NO BOX,DISEÑADOR,GLASSES,OFF WHITE,999,
,1,1,00000406,Off White Sunglasses Lucio - NO BOX,DISEÑADOR,GLASSES,OFF WHITE,999,
,1,1,00000407,Off White Sunglasses Jacob Oerio43 - NO BOX,DISEÑADOR,GLASSES,OFF WHITE,1200,
,1,1,00000408,Off White Sunglasses Gustav White,DISEÑADOR,GLASSES,OFF WHITE,1500,
,1,1,00000409,Off White Sunglasses Vancouver Black,DISEÑADOR,GLASSES,OFF WHITE,1500,
,1,1,00000410,Off White Sunglasses Francisco,DISEÑADOR,GLASSES,OFF WHITE,1500,
,1,1,00000411,Off White Sunglasses Virgil White,DISEÑADOR,GLASSES,OFF WHITE,1500,
,1,1,00000412,Off White Sunglasses Branson Square,DISEÑADOR,GLASSES,OFF WHITE,1500,
,1,1,00000413,Off White Sunglasses Andy Square Red - NO BOX,DISEÑADOR,GLASSES,OFF WHITE,999,
,1,1,00000414,Off White Sunglasses Arthur Black,DISEÑADOR,GLASSES,OFF WHITE,1500,
,1,1,00000415,Off White Sunglasses Salvador - NO BOX,DISEÑADOR,GLASSES,OFF WHITE,999,
,1,1,00000416,Off White Sunglasses Toledo,DISEÑADOR,GLASSES,OFF WHITE,1500,
,1,1,00000417,Off White Sunglasses Andy Square Black,DISEÑADOR,GLASSES,OFF WHITE,1200,
,1,1,00000418,Versace Glasses Havana - NO BOX,DISEÑADOR,GLASSES,VERSACE,899,
,1,1,00000419,Palm Angels Dorris Sunglasses Band Brown - NO BOX,DISEÑADOR,GLASSES,PALM ANGELS,999,
,1,1,00000420,Off White Glasses Optical Style 12 Black Blue Bloc - NO BOX,DISEÑADOR,GLASSES,OFF WHITE,999,
,1,1,00000421,Palm Angels Doyle Sunglasses Crystal Green - NO BOX,DISEÑADOR,GLASSES,PALM ANGELS,999,
,1,1,00000422,Off White Lucio Sunglasses Havana Green - NO BOX,DISEÑADOR,GLASSES,OFF WHITE,999,
,1,1,00000423,Off White Edvard Sunglasses Havana Brown - NO Box,DISEÑADOR,GLASSES,OFF WHITE,999,
,1,1,00000424,Palm Angels Dorris Sunglsses Havana Brown - NO BOX,DISEÑADOR,GLASSES,PALM ANGELS,999,
,1,1,00000425,Off White Dalton Sunglasses Grey - Dark Green - NO BOX,DISEÑADOR,GLASSES,OFF WHITE,999,
,0,,00000426,Amiri Black MA Quad Bi-Fold Wallet,,WALLET,AMIRI,1599,
,2,1,00000427,"Cartera plegable Off-White Quote ""FOR MONEY"" en blanco/negro",DISEÑADOR,WALLET,OFF WHITE,1199,
,1,1,00000428,Off White Monogram Allover Simple Card Case Blue,DISEÑADOR,WALLET,OFF WHITE,599,
,0,,00000429,Off-White Binder clip Wallet.And BLack Stripped Walley,DISEÑADOR,WALLET,OFF WHITE,699,
,1,1,00000430,Palm angels Iconic Bifold Wallet,DISEÑADOR,WALLET,PALM ANGELS,1199,
,1,1,00000431,Off White Jitney Bi-Fold Wallet Black,DISEÑADOR,WALLET,OFF WHITE,1399,
,2,,00000225,Supreme Contrast S Mesh Back 6-Panel Orange - FW25 - US - Regulable malla - Color naranja,,GORRA REGULABLE CURVA,SUPREME,550,
,1,1,17000001,REX - Rexotic Tee Blue - Size XL,STREETWEAR LUJOSO,T-SHIRT,Rexotic,350,
,1,1,17000002,REX - Rexotic Tee Orange - Size M,STREETWEAR LUJOSO,T-SHIRT,Rexotic,350,
,1,1,17000003,REX - Rexotic Tee Orange- Size XL,STREETWEAR LUJOSO,T-SHIRT,Rexotic,350,
,1,1,17000004,REX - Rexotic Monogram Long Sleeve Black - Size XL,STREETWEAR LUJOSO,T-SHIRT MANGA LARGA,Rexotic,250,
,1,1,17000005,REX - Rexotic Zignature Denim - Size 34,STREETWEAR LUJOSO,PANTALON JEANS,Rexotic,650,
,0,,17000006,REX - Rexotic Shoulder Bag Storm Grey Gold,,MORRAL,Rexotic,1519,
,0,,17000007,REX -Rexotic Shoulder Bag Phantom Black Gold,,MORRAL,Rexotic,1519,
,1,1,17000008,REX - Rexotic Wallet - Phantom Black,STREETWEAR LUJOSO,WALLET,Rexotic,459,
,1,1,17000009,REX - Rexotic Wallet - Phantom Grey,STREETWEAR LUJOSO,WALLET,Rexotic,459,
,5,5,17000010,REX - Rexotic Belt Phantom Black Chrome Buckle,STREETWEAR LUJOSO,CORREA,Rexotic,759,
,20,,00000300,Kit Limpieza Deluxe,,LIMPIEZA,TABAS & CARTERAS,,
,15,,00000301,Kit Gamuza,,LIMPIEZA,TABAS & CARTERAS,,
,3,,00000302,Kit Acondicionador Cueros,,ACONDICIONADOR,TABAS & CARTERAS,,
,5,,00000303,Tabas&Carteras Acondicionador Cueros,,ACONDICIONADOR,TABAS & CARTERAS,,
,4,,00000304,Pack Paños Micro Fibra,,PAñOS,TABAS & CARTERAS,,
,10,,00000305,Premium Cleaner 1Lt,,LIMPIEZA,TABAS & CARTERAS,,
,2,,00000306,Repelente,,REPELENTE,TABAS & CARTERAS,,
,4,,00000307,Desodorizador,,LIMPIEZA,TABAS & CARTERAS,,
,5,,00000308,Cleaner Bowl,,LIMPIEZA,TABAS & CARTERAS,,
,1,1,00000118,Palm Angels All Over Palms Bucket Cap 'Black/Off White - Size S,DISEÑADOR,GORRA CAMPERA,PALM ANGELS,699,
,1,1,00004002,Palm Angels Hoodie Teddy Bear Black - Size L - Color Negro Oso Decapic,DISEÑADOR,HOODIE,PALM ANGELS,2499,
,1,,00004000,Palm Angels Hoodie Teddy Bear Black - Size L - Color Negro Oso Decapic,,HOODIE,PALM ANGELS,2499,
,3,2,00002138,KAWS x Uniqlo Warhol UT Graphic white - Size XL,STREETWEAR LUJOSO,T-SHIRT,UNIQLO X KAWS,300,
,1,1,00002120,Uniqlo Unisex SpongeBob SquarePants Cactus Plant Flea Market UT Black - Size S - Color negro,STREETWEAR LUJOSO,T-SHIRT,UNIQLO,300,
,1,1,00002123,Unisex SpongeBob SquarePants Cactus Plant Uniiqlo Flea Market UT Black - Size XL - Color negro,STREETWEAR LUJOSO,T-SHIRT,UNIQLO,300,
