IMAGEN,"Stock
anterior",STOCK ACTUAL,Código,Nombre,CATEGORIA,Sub categoria,Marca,PRECIO,
,1,2,00000600,SUPREME CHUCKY DOLL FALL WINTER 2020,ACCESORIO,MUñECO CHUCKY,SUPREME,,
,2,2,00000612,SUPREME TAZAS HELLER - Color Rojo,ACCESORIO,TAZAS,SUPREME,150,
,1,1,00000613,SUPREME ZIPPO - Color Rojo,ACCESORIO,ENCENDEDOR,SUPREME,750,
,1,1,00001002,MOCK NECK TEE - Talla L - Color Fucsia,DISEÑADOR,T-SHIRT,PALM ANGELS,1600,
,1,,00001009,SEASONAL LOGO - Talla XXL - Color Verde Palta,DISEÑADOR,T-SHIRT,PALM ANGELS,1399,
,1,1,00001012,STATEMENT MONOGRAM TEE WHITEE ORANGE - Talla L - Color Blanco,DISEÑADOR,T-SHIRT,PALM ANGELS,1399,
,1,1,00001016,STATEMENT MONOGRAM TEE BLACK GREY - Talla M -Color Negro GrisT,DISEÑADOR,T-SHIRT,PALM ANGELS,1399,
,1,1,00001023,NECK LOGO TEE BLUE GREEN - Talla XL - Color Azul,DISEÑADOR,T-SHIRT,PALM ANGELS,1399,
,1,1,00001026,NECK LOGO REG TEE DARK GREY - Talla M - Color Gris Oscuro,DISEÑADOR,T-SHIRT,PALM ANGELS,1499,
,1,,00001030,DOUBLED LOGO OVER TEE BLACK FUCHSIA - Talla XS - Color Negro Fucsia,DISEÑADOR,T-SHIRT,PALM ANGELS,1399,
,1,1,00001031,DOUBLED LOGO OVER TEE BLACK FUCHSIA - Talla S - Color Negro Fucsia,DISEÑADOR,T-SHIRT,PALM ANGELS,1399,
,1,,00001032,DOUBLED LOGO OVER TEE BLACK FUCHSIA - Talla M - Color Negro Fucsia,DISEÑADOR,T-SHIRT,PALM ANGELS,1399,
,1,,00001035,DOUBLED LOGO OVER TEE BLACK FUCHSIA - Talla XXL - Color Negro Fucsia,DISEÑADOR,T-SHIRT,PALM ANGELS,1399,
,1,1,00001037,CLASSIC LOGO OVER TEE BLACK WHITE - Talla L - Color Negro Blanco,DISEÑADOR,T-SHIRT,PALM ANGELS,1499,
,1,1,00001039,CLASSIC LOGO OVER TEE BLACK WHITE - Talla XXL - Color Negro Blanco,DISEÑADOR,T-SHIRT,PALM ANGELS,1499,
,1,,00001043,PARIS MONOGRAM SPRAY TEE BLACK BLACK - Talla XL - Color Negro Negro,DISEÑADOR,T-SHIRT,PALM ANGELS,1399,
,1,1,00001047,LAS VEGAS MONOGRAM SPRAY T BLACK GOLD - Talla L - Color Negro Dorado,DISEÑADOR,T-SHIRT,PALM ANGELS,1399,
,2,1,00001052,LA MONOGRAM SPRAY TEE WHITE - Talla L - Color Blanco Gris,DISEÑADOR,T-SHIRT,PALM ANGELS,1399,VENDIDO UND 08/03/26
,2,1,00001057,BEAR IN MIND OVER TEE BLACK BROWN- Talla L - Color Negro Oso,DISEÑADOR,T-SHIRT,PALM ANGELS,1599,VENDIDO UND 19/12/25
,1,1,00001061,BEAR IN MIND LOOSE TEE WHITE BROWN - Talla M - Color Blanco Crema,DISEÑADOR,T-SHIRT,PALM ANGELS,1599,
,0,,00001069,CLASSIC LOGO POLO SHIRT BLACK WHITE - Talla XXL - Color Negro Camisero,DISEÑADOR,T-SHIRT,PALM ANGELS,1659,
,1,1,00001073,PALM CONCERT TSHIRT BLACK MULTICOLOR - Talla XL - Color Negro Graphic Print,DISEÑADOR,T-SHIRT,PALM ANGELS,1399,
,1,1,00001076,CRAZY MOUTH TSHIRT - Talla M - Color Negro Graphic Mouth,DISEÑADOR,T-SHIRT,PALM ANGELS,1399,
,1,1,00001082,PARADISE PALM TEE BLACK YELLOW - Talla L - Color Negro Amarillo Acid Wash,DISEÑADOR,T-SHIRT,PALM ANGELS,1399,
,1,1,00001087,RACING TEE SLIM FIT BLACK WHITE RED - Talla L - Color Negro Banderas,DISEÑADOR,T-SHIRT,PALM ANGELS,1399,
,1,1,00001092,PALM CURVED LOGO TEE BLACK GREY - Talla L - Color Gris Oscuro,DISEÑADOR,T-SHIRT,PALM ANGELS,1499,
,1,1,00001096,STAFF CLASICC TEE WHITE BLACK - Talla M - Color blanco Basic Palmera,DISEÑADOR,T-SHIRT,PALM ANGELS,1499,
,1,1,00001102,CLASICC LOGO SLIM TEE WHITE BLACK - Talla L - Color Blanco Perla,DISEÑADOR,T-SHIRT,PALM ANGELS,1499,
,1,1,00001106,CURVED LOGO TEE BLACK BLACK - Talla M - Color Negro Negro,DISEÑADOR,T-SHIRT,PALM ANGELS,1399,
,1,1,00001107,CURVED LOGO TEE BLACK BLACK - Talla L - Color Negro Negro,DISEÑADOR,T-SHIRT,PALM ANGELS,1399,
,1,1,00001113,PAXSETAI CLASSIC TEE PETROL BLUE WHI - Talla XL - Color Celeste Palmera fucsia,DISEÑADOR,T-SHIRT,PALM ANGELS,1399,
,1,1,00001118,PALM MEX MONEYGRAM HAAS F1 ORANGE FUCHSIA - Talla XL - Color Naranja Fucsia,DISEÑADOR,T-SHIRT,PALM ANGELS,1399,
,2,2,00001122,MOP MILANO OVER TEE - Talla L - Color Blanco Milano,DISEÑADOR,T-SHIRT,PALM ANGELS,1399,
,1,1,00001128,NY SPRAYED LOGO TEE BLACK BLUE - Talla XL - Color Negro New York,DISEÑADOR,T-SHIRT,PALM ANGELS,1399,
,1,1,00001133,TOKYO SPRAYED LOGO TEE WHITE RED - Talla XL - Color Blanco Tokio,DISEÑADOR,T-SHIRT,PALM ANGELS,1399,
,1,1,00001136,PARIS SPRAYED LOGO TEE BLACK BLACK - Talla M - Color Negro Paris,DISEÑADOR,T-SHIRT,PALM ANGELS,1399,
,1,1,00001141,BURNING MONOGRAM TEE WHITE GOLD - Talla M - Color Blanco Perla Dorado,DISEÑADOR,T-SHIRT,PALM ANGELS,1399,
,1,1,00001142,BURNING MONOGRAM TEE WHITE GOLD - Talla L - Color Blanco Perla Dorado,DISEÑADOR,T-SHIRT,PALM ANGELS,1399,
,1,1,00001146,BERTA CLASSIC TEE WHITE PINK - Talla M - Color Blanco Cocker,DISEÑADOR,T-SHIRT,PALM ANGELS,1499,
,1,1,00001150,PAISLEY BOWLING SHIRT NAVY BLUE NAVY - Talla S (48) - Color Azul Bandana,DISEÑADOR,T-SHIRT,PALM ANGELS,1499,
,1,1,00001157,HOLLY PIN UP TEE BLACK - Talla L - Color Negro Dado,DISEÑADOR,T-SHIRT,PALM ANGELS,1399,
,1,1,00001161,FOGGY PA TEE WHITE BLACK - Talla M - Color Blanco Perla Humo,DISEÑADOR,T-SHIRT,PALM ANGELS,1399,
,1,1,00001167,CURVED LOGO T-SHIRT PALM TREES - Talla L - Color Gris Gaspeado,DISEÑADOR,T-SHIRT,PALM ANGELS,1399,
,1,1,00001172,COLLEGE CLASSIC TEE BLACK WHITE  - Talla L - Color Negro L.A,DISEÑADOR,T-SHIRT,PALM ANGELS,1399,
,1,1,00001176,BLACK GOTHIC PALM OVER TEE WHITE BLACK - Talla M - Color Blanco Negro Gotico,DISEÑADOR,T-SHIRT,PALM ANGELS,1399,
,1,1,00001182,DEC PALM CULTURE REG TEE WHITE BLACK - Talla L - Color Blanco Decoding,DISEÑADOR,T-SHIRT,PALM ANGELS,1499,
,1,1,00001190,UNIVERSITY TEE WHITE BLACK - Talla S - Color Blanco Perla Angel,DISEÑADOR,T-SHIRT,PALM ANGELS,1499,
,1,1,00001197,CROSSROADS BEARS TEE IVORY MULTICOLOR - Talla L - Color Crema Three Bears,DISEÑADOR,T-SHIRT,PALM ANGELS,1499,
,1,1,00001202,IVY PIN UP TEE IVORY BLACK - Talla L - Color Crema Serpiente,DISEÑADOR,T-SHIRT,PALM ANGELS,1399,
,2,2,00001206,ANGEL PENCIL TEE WHITE LIGHT - Talla M - Color Blanco Perla Angel Dorado,DISEÑADOR,T-SHIRT,PALM ANGELS,1399,
,1,1,00001207,ANGEL PENCIL TEE WHITE LIGHT - Talla L - Color Blanco Perla Angel Dorado,DISEÑADOR,T-SHIRT,PALM ANGELS,1399,
,1,1,00001211,TMALL SHARK CLASSIC TEE CREAM BLACK -Talla M - Color Crema Shark,DISEÑADOR,T-SHIRT,PALM ANGELS,1499,
,1,1,00001216,STATEMENT PENCIL CLASSIC T BLACK GREY - Talla M - Negro Azul,DISEÑADOR,T-SHIRT,PALM ANGELS,1399,
,1,1,00001217,STATEMENT PENCIL CLASSIC T BLACK GREY - Talla L - Negro Azul,DISEÑADOR,T-SHIRT,PALM ANGELS,1399,
,1,1,00001221,NECK LOGO REG TEE BURGUNDY RED - Talla M - Color Rojo Vino,DISEÑADOR,T-SHIRT,PALM ANGELS,1399,
,1,1,00001226,CROCO CLASSIC TEE BLACK GREEN - Talla M - Color Negro Cocodrilo,DISEÑADOR,T-SHIRT,PALM ANGELS,1499,
,1,1,00001230,RHUDE BLACK CAVIAR TEE - Talla S - Color Azul Negro,DISEÑADOR,T-SHIRT,RHUDE,1799,
,1,1,00001235,GRAND CRU TEE RHUDE BLACK - Talla S - Color Negro Azul,DISEÑADOR,T-SHIRT,RHUDE,1799,
,1,1,00001241,GRAND CRU TEE VINTAGE CREAM - Talla M - Color Crema,DISEÑADOR,T-SHIRT,RHUDE,1799,
,1,1,00001246,ABSTRACT HERON PRINT TSHIRT - Talla M - Color Gris Naranja,DISEÑADOR,T-SHIRT,HERON PRESTON,1499,
,1,1,00001251,REG HPNY TEE BLACK WHITE - Talla M - Color Negro,DISEÑADOR,T-SHIRT,HERON PRESTON,1399,
,1,1,00001256,NF HERON BW TEE BLACK - Talla M - Color Negro Ave,DISEÑADOR,T-SHIRT,HERON PRESTON,1499,
,1,2,00001261,BOOKISH STRIPES SKATE WHITE TRUE BLUE OFF WHITE - Talla M - Color Blanco Manga Azul,DISEÑADOR,T-SHIRT,OFF WHITE,1599,
,1,1,00001263,BOOKISH STRIPES SKATE WHITE TRUE BLUE OFF WHITE - Talla XL - Color Blanco Manga Azul,DISEÑADOR,T-SHIRT,OFF WHITE,1599,
,1,2,00001266,MONALISA OVER TEE WHITE BLACK OFF WHITE -  Talla M - Color Blanco,DISEÑADOR,T-SHIRT,OFF WHITE,1699,
,1,2,00001267,DIAG PKT SLIM TEE WHITE BLACK OFF WHITE - Talla L - Color Blanco Bolsillo,DISEÑADOR,T-SHIRT,OFF WHITE,1699,
,2,4,00001272,CLB SLIM TEE WHITE BLACK OFF WHITE - Talla L - Color Blanco,DISEÑADOR,T-SHIRT,OFF WHITE,1699,
,2,2,00001276,CLB SLIM TEE BLACK WHITE OFF WHITE - Talla M - Color Negro,DISEÑADOR,T-SHIRT,OFF WHITE,1699,
,1,1,00001277,CLB SLIM TEE BLACK WHITE OFF WHITE - Talla L - Color Negro,DISEÑADOR,T-SHIRT,OFF WHITE,1699,
,4,4,00001281,BARBER 2 SLIM TEE BLACK WHITE OFF WHITE - Talla M - Color Negro,DISEÑADOR,T-SHIRT,OFF WHITE,1599,
,1,2,00001283,BARBER 2 SLIM TEE BLACK WHITE OFF WHITE - Talla XL - Color Negro,DISEÑADOR,T-SHIRT,OFF WHITE,1599,
,2,2,00001292,BARBER 2 SLIM TEE DEEP BLUE OFF WHITE - Talla L - Color Morado,DISEÑADOR,T-SHIRT,OFF WHITE,1599,
,1,2,00001296,MONALISA SLIM TEE WHITE BLUE - Talla M - Color Blanco,DISEÑADOR,T-SHIRT,OFF WHITE,1699,
,1,1,00001301,BARBER ARROW SKATE TEE WHITE SERENIT OFF WHITE - Talla M - Color Blanco,DISEÑADOR,T-SHIRT,OFF WHITE,1699,
,1,,00001308,SLF ARROW SKATE TEE BLACK WHITE OFF WHITE - Talla XL - Color Negro Acid Wash,DISEÑADOR,T-SHIRT,OFF WHITE,1599,
,1,,00001311,WINDY ARROW SLIM TEE LIGHT GREY MELANGE OFF WHITE - Talla M - Color Plomo,DISEÑADOR,T-SHIRT,OFF WHITE,1599,
,1,,00001318,DIAG TAB SLIM TEE PEACOCK - Talla XL - Color Azul,DISEÑADOR,T-SHIRT,OFF WHITE,1399,
,1,1,00001320,I SUPPORT SPORT FOR CHANGE X AC MILAN - Talla S - Color Negro,DISEÑADOR,T-SHIRT,OFF WHITE,1299,
,1,1,00001327,IMAGINARY TV REGULAR TEE OPTICAL WHITE - Talla L - Color Blanco,DISEÑADOR,T-SHIRT,OFF WHITE,1399,
,1,1,00001332,23 VARSITY SKATE TEE MELANGE GREY - Talla L - Color Plomo,DISEÑADOR,T-SHIRT,OFF WHITE,1399,
,1,,00001336,OFF STAMP SKATE TEE WHITE BLACK - Talla M - Color Blanco,DISEÑADOR,T-SHIRT,OFF WHITE,1599,
,1,1,00001343,OFF STAMP SKATE TEE BLACK RED - Talla XL - Color Negro,DISEÑADOR,T-SHIRT,OFF WHITE,1599,
,1,1,00001346,PALACE ARROW REG TEE WHITE BLACK - Talla M - Color Blanco,DISEÑADOR,T-SHIRT,OFF WHITE,1599,
,0,,00001352,SB SLIM ARROW TEE WHTE LIGHT BLUE - Talla L - Color Blanco,DISEÑADOR,T-SHIRT,OFF WHITE,1599,
,3,3,00001356,PUFFY LOGO SKATE TEE BLACK CITRUS - Talla M - Color Negro,DISEÑADOR,T-SHIRT,OFF WHITE,1599,
,1,1,00001361,OFF SHARED SKATE TEE BLACK WHITE - Talla M - Color Negro,DISEÑADOR,T-SHIRT,OFF WHITE,1599,
,1,,00001368,SG SINDALAH T SHIRT BLACK LIGHT BLUE - Talla XL - Color Negro,DISEÑADOR,T-SHIRT,OFF WHITE,1599,
,1,1,00001372,MAKING THE WORLD CACTUS JACK X WWE - Talla L  - Color Blanco,STREETWEAR LUJOSO,T-SHIRT,TRAVIS SCOTT,1499,
,0,0,00001375,Amiri Baroque Logo Print T-shirt Black - Size S,DISEÑADOR,T-SHIRT,AMIRI,2200,
,1,1,00001382,ABC CAMO BUSY WORKS TEE - Talla L- Color Blanco,STREETWEAR LUJOSO,T-SHIRT,BAPE,750,
,1,,00001387,GLITTER BY BATHING APE TEE - Talla L - Color Negro,STREETWEAR LUJOSO,T-SHIRT,BAPE,749,
,1,1,00001392,MAD SHARK PHOTO PRINT RELAXED FIT TEE BLACK - Talla L - Color Negro,STREETWEAR LUJOSO,T-SHIRT,BAPE,759,
,1,,00001393,MAD SHARK PHOTO PRINT RELAXED FIT TEE BLACK - Talla XL - Color Negro,STREETWEAR LUJOSO,T-SHIRT,BAPE,759,
,1,,00001398,MAD SHARK PHOTO PRINT RELAXED FIT TEE WHITE - Talla XL - Color Blanco,STREETWEAR LUJOSO,T-SHIRT,BAPE,759,
,0,1,00001402,1ST CAMO SEPARATE SHARK T-SHIRT - Talla L - Color Blanco,STREETWEAR LUJOSO,T-SHIRT,BAPE,759,
,1,1,00001408,TENIS CLUB ICON SCREEN CASA BLANCA - Talla XL - Color Blanco,DISEÑADOR,T-SHIRT,CASA BLANCA,1599,
,1,1,00001414,PLAYFUL EAGLE PRINTED WHITE JERSEY - Talla XXL - Color Blanco,DISEÑADOR,T-SHIRT,CASA BLANCA,1599,
,1,1,00001419,UNITY IS POWER PRINTED WHITE JERSEY - Talla XXL - Color Blanco,DISEÑADOR,T-SHIRT,CASA BLANCA,1599,
,1,1,00001422,TENIS CLUB ICON T-SHIRT - Talla L - Color Blanco,DISEÑADOR,T-SHIRT,CASA BLANCA,1599,
,1,1,00001426,ENGLISH BREAKFAST TEE PLEASURE BLACK - Talla M - Color Negro,STREETWEAR LUJOSO,T-SHIRT,PLEASURE,1599,
,1,,00001443,BASIC STUSSY BLACK T-SHIRT - Talla XL - Color Negro,,T-SHIRT,STUSSY,550,
,1,,00001450,BY ANY MEANS BLING TEE VALLEY CREAM PEDRERIA - Talla S - Color Crema,,T-SHIRT,VALLEY FOREVER,799,
,1,,00001451,BY ANY MEANS BLING TEE VALLEY CREAM PEDRERIA - Talla M - Color Crema,,T-SHIRT,VALLEY FOREVER,799,
,1,,00001452,BY ANY MEANS BLING TEE VALLEY CREAM PEDRERIA - Talla L - Color Crema,,T-SHIRT,VALLEY FOREVER,799,
,1,,00001458,VALLEY SPEED BLING TEE GREY PEDRERIA - Talla XL - Color Plomo,,T-SHIRT,VALLEY FOREVER,899,
,1,,00001460,VALLEY FOREVER FALLEN BLING TEE GREY PEDRERIA - Talla S - Color Plomo,,T-SHIRT,VALLEY FOREVER,899,
,1,,00001461,VALLEY FOREVER FALLEN BLING TEE GREY PEDRERIA - Talla M - Color Plomo,,T-SHIRT,VALLEY FOREVER,899,
,1,,00001462,VALLEY FOREVER FALLEN BLING TEE GREY PEDRERIA - Talla L - Color Plomo,,T-SHIRT,VALLEY FOREVER,899,
,1,1,00001465,VALLEY ECHOES OF THE GOLDEN ERA TEE GREY - Talla S - Color Plomo,STREETWEAR LUJOSO,T-SHIRT,VALLEY FOREVER,799,
,1,1,00001466,VALLEY ECHOES OF THE GOLDEN ERA TEE GREY - Talla M - Color Plomo,STREETWEAR LUJOSO,T-SHIRT,VALLEY FOREVER,799,
,0,,00001467,VALLEY ECHOES OF THE GOLDEN ERA TEE GREY - Talla L - Color Plomo,,T-SHIRT,VALLEY FOREVER,799,
,1,1,00001470,VALLEY NAS TEE GREY GREY - Talla S - Color Plomo,STREETWEAR LUJOSO,T-SHIRT,VALLEY FOREVER,799,
,1,1,00001471,VALLEY NAS TEE GREY GREY - Talla M - Color Plomo,STREETWEAR LUJOSO,T-SHIRT,VALLEY FOREVER,799,
,1,,00001472,VALLEY NAS TEE GREY GREY - Talla L - Color Plomo,,T-SHIRT,VALLEY FOREVER,799,
,0,,00001475,FOG TEE DARK OATMEAL - Talla XS - Color Plomo Melange,,T-SHIRT,ESSENTIALS,550,
,1,,00001476,FOG TEE DARK OATMEAL - Talla S - Color Plomo Melange,,T-SHIRT,ESSENTIALS,550,
,2,2,00001478,FOG TEE DARK OATMEAL - Talla L - Color Plomo Melange,STREETWEAR LUJOSO,T-SHIRT,ESSENTIALS,550,
,2,2,00001479,FOG TEE DARK OATMEAL - Talla XL - Color Plomo Melange,STREETWEAR LUJOSO,T-SHIRT,ESSENTIALS,550,
,1,1,00001483,FOG TEE CREAM - Talla XL- Color Crema,STREETWEAR LUJOSO,T-SHIRT,ESSENTIALS,550,
,1,1,00001485,FOG T-SHIRT IRON - Talla S - Color Plomo Hierro,STREETWEAR LUJOSO,T-SHIRT,ESSENTIALS,550,
,1,,00001490,FOG T-SHIRT WHITE - Talla S - Color Blanco,,T-SHIRT,ESSENTIALS,550,
,1,1,00001498,FOG T-SHIRT WHITE - Talla XL - Color Blanco,STREETWEAR LUJOSO,T-SHIRT,ESSENTIALS,550,
,1,,00001500,FOG T-SHIRT SYCAMORE - Talla S - Color Verde Agua,,T-SHIRT,ESSENTIALS,550,
,1,1,00001502,FOG T-SHIRT SYCAMORE - Talla L - Color Verde Agua,STREETWEAR LUJOSO,T-SHIRT,ESSENTIALS,550,
,1,1,00001505,FOG LIGHT HEATHER OATMEAL - Talla S - Color Beige Arena,STREETWEAR LUJOSO,T-SHIRT,ESSENTIALS,550,
,1,1,00001512,FOG T-SHIRT CREAM -Talla L - Color Crema,STREETWEAR LUJOSO,T-SHIRT,ESSENTIALS,550,
,1,1,00001515,FOG TEE HEATHER GREY - Talla S - Color Plomo Marron,STREETWEAR LUJOSO,T-SHIRT,ESSENTIALS,550,
,1,1,00001523,FOG TEE OATMEAL - Talla XL - Color Plomo Crema,STREETWEAR LUJOSO,T-SHIRT,ESSENTIALS,550,
,1,1,00001526,FOG TEE LIGH OATMEAL - Talla M - Color Plomo Claro,STREETWEAR LUJOSO,T-SHIRT,ESSENTIALS,550,
,3,2,00001527,FOG TEE LIGH OATMEAL - Talla L - Color Plomo Claro,STREETWEAR LUJOSO,T-SHIRT,ESSENTIALS,550,VENTA UND 19/12/25
,2,2,00001528,FOG TEE LIGH OATMEAL - Talla XL - Color Plomo Claro,STREETWEAR LUJOSO,T-SHIRT,ESSENTIALS,550,
,1,1,00001530,FOG TEE STRECH LIMO - Talla XS - Color Negro Verdoso,STREETWEAR LUJOSO,T-SHIRT,ESSENTIALS,550,
,0,,00001533,FOG TEE STRECH LIMO - Talla L - Color Negro Verdoso,,T-SHIRT,ESSENTIALS,550,
,0,,00001535,FOG T-SHIRT STRECH LIMO FRONTAL LOGO - Talla XS - Color Negro Verdoso,,T-SHIRT,ESSENTIALS,550,
,1,,00001538,FOG T-SHIRT STRECH LIMO FRONTAL LOGO - Talla L - Color Negro Verdoso,,T-SHIRT,ESSENTIALS,550,
,1,,00001540,FOG T-SHIRT SS24 SEAL - Talla S - Color Beige Arena,,T-SHIRT,ESSENTIALS,550,
,1,,00001545,FOG ESSENTIALS JERSEY CREWNECK T-SHIRT BLACK - Talla S - Color Negro Logo Blanco,,T-SHIRT,ESSENTIALS,550,
,0,,00001547,FOG ESSENTIALS JERSEY CREWNECK T-SHIRT BLACK - Talla L - Color Negro Logo Blanco,,T-SHIRT,ESSENTIALS,550,
,1,,00001555,FOG TSHIRT CREWNECK HEATHER GRAY - Talla S - Color Plomo Melange,,T-SHIRT,ESSENTIALS,550,
,0,,00001561,FOG TSHIRT CORAL - Talla M - Color Melon,,T-SHIRT,ESSENTIALS,550,
,1,1,00001562,FOG TSHIRT CORAL - Talla L - Color Melon,STREETWEAR LUJOSO,T-SHIRT,ESSENTIALS,550,
,1,1,00001566,SUPREME TYLER THE CREATOR TEE GREY - Talla M - Color Plomo Melange,STREETWEAR LUJOSO,T-SHIRT,SUPREME,599,
,1,1,00001567,SUPREME TYLER THE CREATOR TEE GREY - Talla L - Color Plomo Melange,STREETWEAR LUJOSO,T-SHIRT,SUPREME,599,
,1,1,00001568,SUPREME TYLER THE CREATOR TEE GREY - Talla XL - Color Plomo Melange,STREETWEAR LUJOSO,T-SHIRT,SUPREME,599,
,1,1,00001571,SUPREME DIAMONDS TEE BROWN - Talla M - Color Marron,STREETWEAR LUJOSO,T-SHIRT,SUPREME,550,
,1,1,00001573,SUPREME DIAMONDS TEE BROWN - Talla XL - Color Marron,STREETWEAR LUJOSO,T-SHIRT,SUPREME,550,
,0,,00001578,SUPREME TAPE TEE WHITE - Talla XL - Color Blanco,,T-SHIRT,SUPREME,550,
,0,,00001583,SUPREME TAPE TEE BLACK - Talla XL - Color Negro,,T-SHIRT,SUPREME,550,
,1,1,00001586,SUPREME HARDCORE TEE BLACK - Talla M - Color Negro,STREETWEAR LUJOSO,T-SHIRT,SUPREME,550,
,1,1,00001587,SUPREME HARDCORE TEE BLACK - Talla L - Color Negro,STREETWEAR LUJOSO,T-SHIRT,SUPREME,550,
,1,1,00001588,SUPREME HARDCORE TEE BLACK - Talla XL - Color Negro,STREETWEAR LUJOSO,T-SHIRT,SUPREME,550,
,1,1,00001592,SUPREME HARDCORE TEE WHITE - Talla L - Color Blanco,STREETWEAR LUJOSO,T-SHIRT,SUPREME,550,
,1,1,00001593,SUPREME HARDCORE TEE WHITE - Talla XL - Color Blanco,STREETWEAR LUJOSO,T-SHIRT,SUPREME,550,
,1,1,00001598,SUPREME THRASHER CROSS TEE BLACK - Talla XL - Color Negro,STREETWEAR LUJOSO,T-SHIRT,SUPREME,550,
,1,1,00001602,SUPREME T-REX TEE - Talla L - Color Marron,STREETWEAR LUJOSO,T-SHIRT,SUPREME,550,
,0,,00001607,SUPREME COLLEGIATE TEE - Talla L - Color Azul,,T-SHIRT,SUPREME,550,
,1,1,00001611,SUPREME RONIN TEE - Talla M - Color Blanco,STREETWEAR LUJOSO,T-SHIRT,SUPREME,550,
,1,1,00001616,SUPREME LAGER S/S TOP RED - Talla M - Color Rojo,STREETWEAR LUJOSO,T-SHIRT,SUPREME,550,
,1,,00001621,SUPREME CREST APPLIQUE HALF ZIP PULLOVER RED - Talla M - Color Rojo,,POLERA,SUPREME,1499,
,1,1,00001626,SUPREME BERNADETTE CORPORATION MONEY TEE - Talla M - Color Morado,STREETWEAR LUJOSO,T-SHIRT,SUPREME,550,
,0,,00001631,SUPREME BLOOD TEE SKY BLUE - Talla M - Color Celeste,,T-SHIRT,SUPREME,550,
,1,1,00001635,SUPREME AMERICAN PSYCHO TEE - Talla S - Color Guinda,STREETWEAR LUJOSO,T-SHIRT,SUPREME,550,
,1,1,00001642,SUPREME VARSITY TEE GREY - Size L - Color Plomo Melange,STREETWEAR LUJOSO,T-SHIRT,SUPREME,550,
,1,1,00001647,SUPREME DRUG TEE GREY - Talla L - Color Plomo Melange,STREETWEAR LUJOSO,T-SHIRT,SUPREME,550,
,1,,00001651,SUPREME MISTER CARTOON POW TEE - Talla M - Color Negro,,T-SHIRT,SUPREME,699,
,1,1,00001655,SUPREME TOY MACHINE DEVIL CAT TEE - Talla S - Color Negro,STREETWEAR LUJOSO,T-SHIRT,SUPREME,550,
,1,,00001660,SUPRIME THREE KINGS TEE - Talla S - Color Negro Azulado,,T-SHIRT,SUPREME,550,
,1,1,00001665,SUPRIME HELL TEE - Talla S - Color Azul Marino,STREETWEAR LUJOSO,T-SHIRT,SUPREME,550,
,1,,00001670,SUPRIME AL GREEN TEE - Talla S - Color Verde agua,,T-SHIRT,SUPREME,550,
,1,1,00001675,KITH MARVEL SPIDERMAN HOMECOMING TEE - Talla S - Color crema,STREETWEAR LUJOSO,T-SHIRT,KITH,180,
,1,,00001680,KITH TREATS DOUGHNUT VINTAGE TEE - Talla XS - Color Negro,,T-SHIRT,KITH,180,
,1,,00001689,FLOCK ARROW SLIM TEE BEIGE BLACK - Talla XXL - Color Beige,,T-SHIRT,OFF WHITE,1599,
,1,,00001692,HAMMER SKATE TEE BLACK BLUE - Talla L - Color Negro 2013,,T-SHIRT MANGA LARGA,OFF WHITE,1399,
,1,,00001695,CARAVAGGIO LUTE TEE BLACK MULTICOLOR - Talla S - Color Negro Manga Larga,,T-SHIRT MANGA LARGA,OFF WHITE,1699,
,1,,00001700,GRAFF WHT PUPP SKATE WHITE MULTICOLOR - Talla XS - Color Blanco,,T-SHIRT MANGA LARGA,OFF WHITE,1000,
,1,1,00001706,VALLEY LOVE ICE OF LIGHT GREY - Talla M - Color Plomo,STREETWEAR LUJOSO,T-SHIRT MANGA LARGA,VALLEY FOREVER,899,
,1,,00001707,VALLEY LOVE ICE OF LIGHT GREY - Talla L - Color Plomo,,T-SHIRT MANGA LARGA,VALLEY FOREVER,899,
,0,,00001712,FC Barcelona x Travis Scott - Size L -  Color Guinda Azul,,CAMISETA,TRAVIS SCOTT,1599,
,1,1,00001717,ACM X OFF WHITE JSY REPLIC PUMA BLACK POWER GREEN - Talla L - Color Negro,DISEÑADOR,CAMISETA,OFF WHITE,1800,
,1,1,00003000,ALLOVER PALMS BOWLING SHIR BLACK WHITE - Talla S (48) - Negro Camisa,DISEÑADOR,CAMISA,PALM ANGELS,1499,
,1,1,00003005,PALMS ALLOVER SHIRT BLACK WHITE - Talla S (46) - Color Negro Camisa,DISEÑADOR,CAMISA,PALM ANGELS,1499,
,1,1,00003010,DAMIER PRINT BOWLING SHIR BLACK RED - Talla S (46) - Color Negro cuadros Camisa,DISEÑADOR,CAMISA,PALM ANGELS,1899,
,1,1,00003018,STAR ARROW POPL BOWLING SH WHITE BLACK - Talla XL (48) - Color Blanco,DISEÑADOR,CAMISA,OFF WHITE,1899,
,1,1,00003024,STAR ARROW POPL BOWLING SH WHITE BLACK - Talla XXL (52) - Color Blanco,DISEÑADOR,CAMISA,OFF WHITE,1899,
,1,1,00003027,Gang Popl Bowling Shirt Black White - Size L (48) - Color Negro,DISEÑADOR,CAMISA,OFF WHITE,1800,
,1,1,00003033,Off White Spray Arrow Popl Bowling White Black - Size XL (50) - Color Blanco,DISEÑADOR,CAMISA,OFF WHITE,1800,
,1,1,00003037,TYPE AO VISC BOWLING SHIRT BLACK - Talla L (48) - Color Negro,DISEÑADOR,CAMISA,OFF WHITE,1699,
,0,,00003048,FRESCO ARROW POPL BOWLING WHITE MULTICOLOR - Talla XL (52) - Color Blanco,,CAMISA,OFF WHITE,1999,
,1,1,00003052,POCKET SHIRT NYLON BLACK GREEN - Talla L - Color Negro Camisa,DISEÑADOR,CAMISA,HERON PRESTON,1499,
,0,,00003056,PUTTI POPL BOWLING SHIRT BLACK WHITE - Talla M (46) - Color Negro,,CAMISA,OFF WHITE,1899,
,1,,00003057,PUTTI POPL BOWLING SHIRT BLACK WHITE - Talla L (48) - Color Negro,DISEÑADOR,CAMISA,OFF WHITE,1899,
,1,,00003063,JERSEY OFF WHITE GOTHIC BASEBALL BRAND - Talla XL (48) - Color Blanco,DISEÑADOR,CAMISA,OFF WHITE,1799,
,1,1,00003067,EMBOSSED BANDANA OVERSHIRT CREAM  - Talla L (48) - Color Crema,DISEÑADOR,CAMISA MANGA LARGA,PALM ANGELS,1200,
,1,1,00003074,CLASSIC LOGO OVER SHIRT BLACK GREY - Talla XXL - Color Negro Gris Cuadros,DISEÑADOR,CAMISA MANGA LARGA,PALM ANGELS,1200,
,1,1,00003078,23 LOGO HEAVYCOT OVERSHIRT WHITE BLACK - Talla XL - Color Blanco,DISEÑADOR,CAMISA MANGA LARGA,OFF WHITE,1999,
,1,1,00003079,23 LOGO HEAVYCOT OVERSHIRT WHITE BLACK - Talla XXL  - Color Blanco,DISEÑADOR,CAMISA MANGA LARGA,OFF WHITE,1999,
,1,1,00003080,ARROW FLANNEL SHIRT BLACK WHITE - Talla S - Color Verde cuadro negro,DISEÑADOR,CAMISA FRANELA,OFF WHITE,1799,
,1,1,00003087,HELVET FINE KNIT RIB TURTL GREEN - Talla L - Color Verde,DISEÑADOR,CAFARENA MUJER,OFF WHITE,999,
,1,1,00003093,HELVET FINE KNIT RIB TURTL BEIGE - Talla XL - Color Beige,DISEÑADOR,CAFARENA MUJER,OFF WHITE,999,
,0,,00004001,HOODIE TEDDY BEAR BLACK - Talla M - Color Negro Oso Decapic,,HOODIE,PALM ANGELS,2499,
,1,1,12000022,JR - Palm Angels Hoodie Bear In Mind Black - Size L,DISEÑADOR,HOODIE,PALM ANGELS,2499,
,1,1,00004011,Palm Angels HOODIE CURVED LOGO PALM ANGELS - Talla M - Color Negro Classic,DISEÑADOR,HOODIE,PALM ANGELS,2200,
,1,1,00004016,HOODIE MOONLIGHT RHUDE - Talla M - Color Negro Azul,DISEÑADOR,HOODIE,RHUDE,2200,
,1,1,00004020,HERON TIME FLAMES HOODIE BLACK RED - Talla S - Negro Rojo,DISEÑADOR,HOODIE,HERON PRESTON,2600,
,1,1,00004028,FLOCK ARROW SKATE HOODIE BLACK WHITE - Talla XL - Color negro,DISEÑADOR,HOODIE,OFF WHITE,2499,
,1,,00004030,FOOTBALL OVER HODDIE COLLEGE GREEN - Talla S - Color Verde,,HOODIE,OFF WHITE,2399,
,1,1,00004038,OW 23 SKATE HOODIE NAUTICAL BLUE - Talla XL - Color Azul,DISEÑADOR,HOODIE,OFF WHITE,2499,
,1,1,00004042,HOODIE DIAG HELVETICA OFF WHITE BLACK - Talla L - Color Negro,DISEÑADOR,HOODIE,OFF WHITE,2399,
,1,1,00004046,HOODIE OFF WHITE FOOTBALL OVER BLACK - Talla M - Color Negro,DISEÑADOR,HOODIE,OFF WHITE,2499,
,0,,00004052,TRAVIS SCOTT X FOX RACING II HOODIE - Talla L - Color Marron,,HOODIE,TRAVIS SCOTT,1499,
,1,1,00004057,AMIRI STARBURST HOODIE BLACK - Talla L - Color Negro,DISEÑADOR,HOODIE,AMIRI,2399,
,0,,00004062,BAPE CAMO COLLAGE PULLOVER HOODIE NAVY - Talla L - Color Azul Camuflado,,HOODIE,BAPE,1499,
,1,1,00004063,BAPE CAMO COLLAGE PULLOVER HOODIE NAVY - Talla XL - Color Azul Camuflado,STREETWEAR LUJOSO,HOODIE,BAPE,1499,
,1,,00004067,VALLEY FREEDOM ZIP UP MAUVE - Talla L - Color Morado,,HOODIE,VALLEY FOREVER,1499,
,1,1,00004070,VALLEY FOREVER CASPER ZIP UP HOODIE GREY - Talla S - Color Plomo,STREETWEAR LUJOSO,HOODIE,VALLEY FOREVER,1399,
,0,,00004078,VALLEY SKYLINE ZIP UP HOODIE MULTICOLOR - Talla XL - Color Azul,,HOODIE,VALLEY FOREVER,1399,
,0,,00004081,VALLEY NOISE ZIP UP DARK GREY - Talla M - Color Plomo,,HOODIE,VALLEY FOREVER,1459,
,1,1,16000043,JAM - FOG HOODIE DARK OATMEAL - Talla S - Color Plomo Melange,STREETWEAR LUJOSO,HOODIE,ESSENTIALS,750,
,1,1,00004093,FOG HOODIE STRECH LIMO - Size XL - Color Negro Verdoso,STREETWEAR LUJOSO,HOODIE,ESSENTIALS,750,
,1,1,00004100,FOG HOODIE PLUM - Talla S - Color Marron,STREETWEAR LUJOSO,HOODIE,ESSENTIALS,750,
,1,1,00004106,FOG HOODIE SYCAMORE - Talla M - Color Verde Agua,STREETWEAR LUJOSO,HOODIE,ESSENTIALS,750,
,1,1,00004107,FOG HOODIE SYCAMORE - Talla L - Color Verde Agua,STREETWEAR LUJOSO,HOODIE,ESSENTIALS,750,
,1,1,00004112,FOG HOODIE  TAUPE - Talla L - Color Kaki,STREETWEAR LUJOSO,HOODIE,ESSENTIALS,750,
,1,,00004116,FOG FLEECE HOODIE LIGHT HEATHER GRAY - Talla M - Color Plomo Melange,,HOODIE,ESSENTIALS,750,
,1,1,00004117,FOG FLEECE HOODIE LIGHT HEATHER GRAY - Talla L - Color Plomo Melange,STREETWEAR LUJOSO,HOODIE,ESSENTIALS,750,
,0,,00004120,FOG HOODIE LIGHT OATMEAL - Talla XS - Color Plomo Claro,,HOODIE,ESSENTIALS,750,
,1,1,16000044,JAM - FOG HOODIE LIGHT OATMEAL - Size S,STREETWEAR LUJOSO,HOODIE,ESSENTIALS,750,
,1,,00004122,JAM - FOG HOODIE LIGHT OATMEAL - Talla M - Color Plomo Claro,,HOODIE,ESSENTIALS,750,
,1,1,00004123,FOG HOODIE LIGHT OATMEAL - Talla L - Color Plomo Claro,STREETWEAR LUJOSO,HOODIE,ESSENTIALS,750,
,1,,00004124,FOG HOODIE LIGHT OATMEAL - Talla XL - Color Plomo Claro,,HOODIE,ESSENTIALS,750,
,1,1,00004125,FOG HOODIE DESERT TAUPE - Talla S - Color Beige Claro,STREETWEAR LUJOSO,HOODIE,ESSENTIALS,750,
,1,1,00004130,FOG HOODIE WOOD - Talla XS - Color Verde,STREETWEAR LUJOSO,HOODIE,ESSENTIALS,750,
,1,1,00004132,FOG HOODIE WOOD - Talla M - Color Verde,STREETWEAR LUJOSO,HOODIE,ESSENTIALS,750,
,1,1,00004135,FOG HOODIE ESSENTIALS EGGSHELL - Talla S - Color Crema Claro,STREETWEAR LUJOSO,HOODIE,ESSENTIALS,750,
,1,1,00004137,FOG HOODIE ESSENTIALS EGGSHELL - Talla L - Color Crema Claro,STREETWEAR LUJOSO,HOODIE,ESSENTIALS,750,
,1,1,00004142,FOG HOODIE 1977 GREY - Talla L - Color Plomo Melange,STREETWEAR LUJOSO,HOODIE,ESSENTIALS,750,
,2,1,00004145,FOG HOODIE 1977 WHEAT - Talla S - Color crema,STREETWEAR LUJOSO,HOODIE,ESSENTIALS,750,VENTA SALE EN TALLA XS PERO EN STOK NO HAY XS 
