IMAGEN,"Stock
anterior",STOCK ACTUAL,Código,Nombre,CATEGORIA,Sub categoria,Marca,PRECIO,
,1,1,00004146,FOG HOODIE 1977 WHEAT - Talla M - Color crema,STREETWEAR LUJOSO,HOODIE,ESSENTIALS,750,
,1,1,00004147,FOG HOODIE 1977 WHEAT - Talla L - Color crema,STREETWEAR LUJOSO,HOODIE,ESSENTIALS,750,
,1,1,00004151,FOG HOODIE OFF BLACK - Talla M - Color Negro Verdoso,STREETWEAR LUJOSO,HOODIE,ESSENTIALS,750,
,1,1,00004156,FOG HOODIE SHRUNKEN HAETHER GRAY - Talla M - Color Plomo,STREETWEAR LUJOSO,HOODIE,ESSENTIALS,750,
,1,1,00004157,FOG HOODIE SHRUNKEN HAETHER GRAY - Talla L - Color Plomo Marron,STREETWEAR LUJOSO,HOODIE,ESSENTIALS,750,
,1,,00004160,FOG HOODIE HEATHER GRAY - Talla XS - Color Plomo Marron,,HOODIE,ESSENTIALS,750,
,1,1,00004161,FOG HOODIE HEATHER GRAY - Talla S - Color Plomo,STREETWEAR LUJOSO,HOODIE,ESSENTIALS,750,
,1,1,00004163,FOG HOODIE HEATHER GRAY - Talla L - Color Plomo Marron,STREETWEAR LUJOSO,HOODIE,ESSENTIALS,750,
,1,1,00004167,FOG HOODIE SMOKE - Talla L - Color Plomo Humo,STREETWEAR LUJOSO,HOODIE,ESSENTIALS,750,
,1,1,00004168,FOG HOODIE SMOKE - Talla XL - Color Plomo Humo,STREETWEAR LUJOSO,HOODIE,ESSENTIALS,750,
,1,1,00004173,DENIM TEARS THE COTTON WREATH SWEATSHIRT PINK - Talla XL - Color Rosado,STREETWEAR LUJOSO,HOODIE,DENIM TEARS,1500,
,1,1,00004177,HOODIE JORDAN X NINA CHANEL ORANGE - Talla L - Color Naranja,STREETWEAR LUJOSO,HOODIE,JORDAN X NINA CHANELL,1200,
,1,1,00004180,Palm Angels Palms Pencil Crew Sudadera Negro Hombre Black - Size S,DISEÑADOR,POLERA CREW NECK,PALM ANGELS,1599,
,1,1,00004187,LOGO FLAMES VINT CREW BLACK RED - Talla L - Color Negro Acid Wash,DISEÑADOR,POLERA CREW NECK,PALM ANGELS,1999,
,0,,00004191,HERON LAW FLAMES CREWNECK GREY WHITE - Talla M - Color Gris,,POLERA CREW NECK,HERON PRESTON,2300,
,1,1,00004197,AMIRI MUSIC RECORD CREW - Talla L - Color Negro,DISEÑADOR,POLERA CREW NECK,AMIRI,2200,
,1,1,00004201,OVER DYET DENIM SKATE JACKET BROWN - Talla M - Color Marron,DISEÑADOR,CASACA JEANS,OFF WHITE,1899,
,1,1,00004206,WINDBREAK PALM ANGELS - Talla M - Color Azul Verde Tornasolado,DISEÑADOR,CASACA - CORTAVIENTO,PALM ANGELS,1000,
,1,,00004211,MILITARY BUFFALO FIELD JACKET MILITARY BLACK - Talla M - Color Verde Militar,,CHAQUETA,PALM ANGELS,1899,
,1,1,00004216,SLIM TRACKTOP BLACK WHITE - Talla M - Color Negro,DISEÑADOR,CHAQUETA DEPORTIVA,OFF WHITE,1499,
,1,1,00005000,FOG SWEATSHORT LIGHT OEATMEAL - Talla XS - Color Plomo Claro,STREETWEAR LUJOSO,SHORT,ESSENTIALS,550,
,0,,00005002,FOG SWEATSHORT LIGHT OEATMEAL - Talla M - Color Plomo Claro,STREETWEAR LUJOSO,SHORT,ESSENTIALS,550,
,2,2,00005003,FOG SWEATSHORT LIGHT OEATMEAL - Talla L - Color Plomo Claro,STREETWEAR LUJOSO,SHORT,ESSENTIALS,550,
,1,1,00005004,FOG SWEATSHORT LIGHT OEATMEAL - Talla XL - Color Plomo Claro,STREETWEAR LUJOSO,SHORT,ESSENTIALS,550,
,1,1,00005006,FEAR OF GOD SWEATSHORT ESSENTIALS JET BLACK - Talla M - Color Negro Cordon Marron,STREETWEAR LUJOSO,SHORT,ESSENTIALS,550,
,1,1,00005010,FEAR OF GOD SWEATSHORT ESSENTIALS IRON - Talla XS - Color Plomo Hierro,STREETWEAR LUJOSO,SHORT,ESSENTIALS,550,
,1,,00005011,FEAR OF GOD SWEATSHORT ESSENTIALS IRON - Talla S - Color Plomo Hierro,STREETWEAR LUJOSO,SHORT,ESSENTIALS,550,
,0,,00005012,FEAR OF GOD SWEATSHORT ESSENTIALS IRON - Talla M - Color Plomo Hierro,STREETWEAR LUJOSO,SHORT,ESSENTIALS,500,
,2,1,00005013,FEAR OF GOD SWEATSHORT ESSENTIALS IRON - Talla L - Color Plomo Hierro,STREETWEAR LUJOSO,SHORT,ESSENTIALS,550,NO SALE LA TALLA EN EL REGISTRO
,1,,00005014,FEAR OF GOD SWEATSHORT ESSENTIALS IRON - Talla XL - Color Plomo Hierro,STREETWEAR LUJOSO,SHORT,ESSENTIALS,550,
,0,,00005017,FEAR OF GOD ESSENTIALS CLASSIC SWEATSHORT JET BLACK - Talla L - Negro Verdoso Logo Blanco,STREETWEAR LUJOSO,SHORT,ESSENTIALS,550,
,2,1,00005018,FEAR OF GOD ESSENTIALS CLASSIC SWEATSHORT JET BLACK - Talla XL - Negro Verdoso Logo Blanco,STREETWEAR LUJOSO,SHORT,ESSENTIALS,550,
,1,1,00005020,FOG SWEATSHORT STRECH LIMO S22 - Talla XS - Color Negro Verdoso Logo Negro,STREETWEAR LUJOSO,SHORT,ESSENTIALS,550,
,2,1,00005021,FOG SWEATSHORT STRECH LIMO S22 - Talla S - Color Negro Verdoso Logo Negro,STREETWEAR LUJOSO,SHORT,ESSENTIALS,550,
,0,,00005022,FOG SWEATSHORT STRECH LIMO S22 - Talla M - Color Negro Verdoso Logo Negro,,SHORT,ESSENTIALS,550,
,0,,00005026,FEAR OF GOD ESSENTIALS SHORT (SS21) TAUPE - Talla M - Color Kaki,,SHORT,ESSENTIALS,550,
,0,,00005030,FOG SWEATSHORT DARK OARTMEAL - Talla XS - Color Plomo Melange,,SHORT,ESSENTIALS,550,
,2,2,00005033,FOG SWEATSHORT DARK OARTMEAL - Talla L - Color Plomo Melange,STREETWEAR LUJOSO,SHORT,ESSENTIALS,550,
,1,,00005034,FOG SWEATSHORT DARK OARTMEAL - Talla XL - Color Plomo Melange,,SHORT,ESSENTIALS,550,
,1,,00005036,FOG SWEATSHORT ESSENTIALS TAN  - Talla M - Color Beige,,SHORT,ESSENTIALS,550,
,1,,00005047,DENIM TEARS SHORTS BLACK -Talla L - Color Negro,,SHORT,DENIM TEARS,999,
,0,,00005052,ERIC EMANUEL X NEW ERA EE BASIC SHORT CHICAGO BULLS - Talla L - Color Negro,,SHORT,ERIC EMANUEL X NEW ERA,750,
,1,1,00006002,Palm Angels PATCHWORK MILITARY CARGO PANT - Talla L - Color Verde Militar,DISEÑADOR,PANTALON CARGO,PALM ANGELS,1800,
,1,1,00006009,CURVED LOGO BACK 5 POCKETS BLACK WHITE - Talla 36 - Color Negro Gris,DISEÑADOR,PANTALON JEANS,PALM ANGELS,2200,
,1,1,00006012,Off White OVER DYET STRAIGHT JEANS BROWN - Talla 32 - Color Marron,DISEÑADOR,PANTALON JEANS,OFF WHITE,1899,
,1,1,00006022,MA QUAD STRAIGHT - LEG DISTRESSED JEANS AMIRI - Talla 32 - Color Azul,DISEÑADOR,PANTALON JEANS,AMIRI,2200,
,1,2,00006023,MA QUAD STRAIGHT - LEG DISTRESSED JEANS AMIRI - Talla 34 - Color Azul,DISEÑADOR,PANTALON JEANS,AMIRI,2200,
,1,,00006027,IMPACT PINSTRIPE DENIM PLEASURE - Talla 32 - Color azul,,PANTALON JEANS,PLEASURE,1399,
,1,1,00006032,VALLEY COCOA PAINTERS PANT - Talla 32 - Color Marron,STREETWEAR LUJOSO,PANTALON JEANS,VALLEY FOREVER,1499,
,1,1,00006033,VALLEY COCOA PAINTERS PANT - Talla 34 - Color Marron,STREETWEAR LUJOSO,PANTALON JEANS,VALLEY FOREVER,1499,
,1,1,00006037,VALLEY 1980 PAINTERS CREAM - Talla 32 - Color Crema,STREETWEAR LUJOSO,PANTALON JEANS,VALLEY FOREVER,1499,
,1,1,00006038,VALLEY 1980 PAINTERS CREAM - Talla 34 - Color Crema,STREETWEAR LUJOSO,PANTALON JEANS,VALLEY FOREVER,1499,
,1,,00006042,VALLEY FOREVER PANTS GREEN - Talla 32 - Color Verde,,PANTALON JEANS,VALLEY FOREVER,1499,
,1,1,00006043,VALLEY FOREVER PANTS GREEN - Talla 34 - Color Verde,STREETWEAR LUJOSO,PANTALON JEANS,VALLEY FOREVER,1499,
,1,1,00006044,VALLEY FOREVER PANTS GREEN - Talla 36 - Color Verde,STREETWEAR LUJOSO,PANTALON JEANS,VALLEY FOREVER,1499,
,1,1,00006048,VALLEY 1980 PAINTERS BLACK - Talla 34 - Color Negro,STREETWEAR LUJOSO,PANTALON JEANS,VALLEY FOREVER,1499,
,1,1,00007000,CTNMB NYLON TRACKPANTS BLACK WHITE - Talla S - Color Negro,DISEÑADOR,PANTALON BUZO,HERON PRESTON,999,
,1,1,00007008,NIKE AIR JORDAN X OFF WHITE WOVEN BLACK - Talla XL - Color Negro,DISEÑADOR,PANTALON BUZO,OFF WHITE,1299,
,2,1,00007011,FOG RELAXED SWEATPANTS (SS22) LIGHT OATMEAL - Talla M -  Color Plomo Claro,STREETWEAR LUJOSO,PANTALON BUZO,ESSENTIALS,750,
,2,,00007012,FOG RELAXED SWEATPANTS (SS22) LIGHT OATMEAL - Talla L -  Color Plomo Claro,,PANTALON BUZO,ESSENTIALS,750,
,1,1,00007013,FOG RELAXED SWEATPANTS (SS22) LIGHT OATMEAL - Talla XL - Color Plomo Claro,STREETWEAR LUJOSO,PANTALON BUZO,ESSENTIALS,750,
,0,,00007015,FOG RELAXED SWEATPANTS (SS22) STRECH LIMO - Talla XS - Color Negro Verdoso,,PANTALON BUZO,ESSENTIALS,750,
,1,1,00007016,FOG RELAXED SWEATPANTS (SS22) STRECH LIMO - Talla S - Color Negro Verdoso,STREETWEAR LUJOSO,PANTALON BUZO,ESSENTIALS,750,
,0,,00007017,FOG RELAXED SWEATPANTS (SS22) STRECH LIMO - Talla M - Color Negro Verdoso,,PANTALON BUZO,ESSENTIALS,750,
,1,1,00007020,FOG RELAXED SWEATPANTS (SS22) DARK OATMEAL - Size S - Color Plomo Melange,STREETWEAR LUJOSO,PANTALON BUZO,ESSENTIALS,750,
,1,1,00007021,FOG RELAXED SWEATPANTS (SS22) DARK OATMEAL - Talla M - Color Plomo Melange,STREETWEAR LUJOSO,PANTALON BUZO,ESSENTIALS,750,
,1,1,00007022,FOG RELAXED SWEATPANTS (SS22) DARK OATMEAL - Talla L - Color Plomo Melange,STREETWEAR LUJOSO,PANTALON BUZO,ESSENTIALS,750,
,1,1,00007023,FOG RELAXED SWEATPANTS (SS22) DARK OATMEAL - Talla XL - Color Plomo Melange,STREETWEAR LUJOSO,PANTALON BUZO,ESSENTIALS,750,
,1,,00007025,FOG RELAXED SWEATPANTS (SS22) IRON - Talla S - Color Plomo Hierro,STREETWEAR LUJOSO,PANTALON BUZO,ESSENTIALS,750,
,1,,00007027,FOG RELAXED SWEATPANTS (SS22) IRON - Talla L - Color Plomo Hierro,,PANTALON BUZO,ESSENTIALS,750,
,1,1,00007030,FOG FLEECE ESSENTIALS SWEATPANTS BLACK - Talla XS - Color Negro,STREETWEAR LUJOSO,PANTALON BUZO,ESSENTIALS,750,
,1,1,00007037,DENIM TEARS THE COTTON WREATH SWEATPANTS BLACK - Talla L - Color Negro,STREETWEAR LUJOSO,PANTALON BUZO,DENIM TEARS,1100,
,1,1,00000100,Palm Angels Crossroads Bears Cap Black Multicolors - Regulable - Color Negro,DISEÑADOR,GORRA REGULABLE CURVA,PALM ANGELS,550,
,1,1,00000101,CLASSIC LOGO CHECK TRUCKER BLACK GREEN - Regulable Malla - Negro Verde,DISEÑADOR,GORRA REGULABLE CURVA,PALM ANGELS,599,
,1,1,00000102,ESSENTIALS BASEBALL CAP ROYAL BLUE FOG - Color AZUL BLANCO,STREETWEAR LUJOSO,GORRA REGULABLE PLANA,ESSENTIALS X NEW ERA,599,
,0,,00000103,DENIM TEARS THE COTTON WREATH FITTED CAP BLACK - Talla S - Color Negro Regulable,,GORRA REGULABLE CURVA,DENIM TEARS,750,
,0,,00000104,SUPREME X NEW ERA GRADIENT BOX LOGO 59 FIFTY - Talla 7 3/8 - Color Rosado,,GORRA CERRADA PLANA,SUPREME X NEW ERA,550,
,1,1,00000105,SUPREME X NEW ERA GOLD CROSS LOGO - Talla 7 1/4 - Color Azul,STREETWEAR LUJOSO,GORRA CERRADA PLANA,SUPREME X NEW ERA,550,
,0,,00000106,Supreme Bucket Hat Playoffs Mesh Crusher - Size S/M,STREETWEAR LUJOSO,GORRA CAMPERA,SUPREME,650,
,1,1,00000107,NEW ERA 59 FIFTY LOS ANGELES DODGERS MLB - Color Azul,STREETWEAR LUJOSO,GORRA CERRADA PLANA,NEW ERA,499,
,1,1,00000200,PA BEAR BEANIE BLACK BROWN - Talla S - Color Negro Oso Decapic,DISEÑADOR,BEANIE,PALM ANGELS,699,
,1,1,00000203,DAMIER BEANIE BLACK WHiTE - Talla S - Color Blanco Negro Cuadros,DISEÑADOR,BEANIE,PALM ANGELS,550,
,1,1,00000206,COLORBLOCK BEANIE SAND BLACK - Talla S - Color Negro Blanco,DISEÑADOR,BEANIE,PALM ANGELS,499,
,0,,00000209,COLORBLOCK BEANIE BUTTER BLACK - Talla S - Color Negro,,BEANIE,PALM ANGELS,499,
,1,1,00000212,ARROW BEANIE ARMY GREEN BLACK - Talla S - Color Verde,DISEÑADOR,BEANIE,OFF WHITE,559,
,1,,PACK0301,Hanes Crew Socks Fluoryell Pack x 4 - Size S - Color Verde Neon,,MEDIAS,SUPREME,399,
,2,2,PACK0104,Supreme Hanes Boxer Brief White Pack x 4 - Size XL,STREETWEAR LUJOSO,BOXER,SUPREME,399,
,1,,UND00100,HANES BOXER BRIEF - Talla M - Color Blanco 1 und,,BOXER,SUPREME,99.5,
,2,,PACK0300,HANES CREW SOCKS RED - Talla S - Color Rojo 4 Pack,,MEDIAS,SUPREME,399,
,1,1,16000038,JAM - Supreme/Hanes Crew Socks Fluorescent Yellow Pack x 4,STREETWEAR LUJOSO,MEDIAS,SUPREME,399,
,1,,UND00300,Kaws X Andy Warhol X Uniqlo Long Black Socks UNDx1 - Size Estándar,,MEDIAS,KAWS X ANDY WAHOL X UNIQLO,100,
,2,2,00000500,SUPREME FIEL SIDE BAG RED - Color Rojo,STREETWEAR LUJOSO,MORRAL,SUPREME,750,
,1,1,00000501,SUPREME MINI SIDE BAG - Color Beige,STREETWEAR LUJOSO,MORRAL,SUPREME,499,
,1,2,00000503,Supreme Denim Mini Shoulder Bag Realtree Ap Camo,STREETWEAR LUJOSO,MORRAL,SUPREME,550,
,1,,00001722,Palm Angels Maglietta flames fron - Talla L - Color negro,,T-SHIRT,PALM ANGELS,1399,
,1,1,00001726,Palm Angels Foggy PA T-Shirt Black/White - Talla M - Color negro,DISEÑADOR,T-SHIRT,PALM ANGELS,1399,
,1,1,00001727,Palm Angels Foggy PA T-Shirt Black/White - Talla L - Color negro,DISEÑADOR,T-SHIRT,PALM ANGELS,1399,
,1,1,00001732,Palm Angels Men's Neck Logo T-Shirt - Talla L - Color Blanco,DISEÑADOR,T-SHIRT,PALM ANGELS,1399,
,1,1,00001737,Palm Angels teddy bear print cotton T-shirt Cream - Talla L - Color crema,DISEÑADOR,T-SHIRT,PALM ANGELS,1399,
,1,1,00001742,Palm Angels teddy bear print cotton T-shirt Blue - Talla L - Color azul,DISEÑADOR,T-SHIRT,PALM ANGELS,1399,
,1,1,00001747,Palm Angels teddy bear print cotton T-shirt Red - Talla L - Color rojo,DISEÑADOR,T-SHIRT,PALM ANGELS,1399,
,1,1,00001748,Palm Angels teddy bear print cotton T-shirt Red - Talla XL - Color rojo,DISEÑADOR,T-SHIRT,PALM ANGELS,1399,
,1,1,00001753,Palm Angels teddy bear print cotton T-shirtBlack - Talla XL - Color negro,DISEÑADOR,T-SHIRT,PALM ANGELS,1399,
,1,,00001751,Palm Angels Men's College T-Shirt - Talla M - Color Negro,,T-SHIRT,PALM ANGELS,1399,
,1,,00001752,Palm Angels Men's College T-Shirt - Talla L - Color Negro,,T-SHIRT,PALM ANGELS,1399,
,1,1,00001757,Palm Angels Men's College Black T-Shirt - Talla L,DISEÑADOR,T-SHIRT,PALM ANGELS,1399,
,1,1,00001762,Palm Angels Men's Neck Logo T-Shirt Black - Size L,DISEÑADOR,T-SHIRT,PALM ANGELS,1399,
,1,,00001772,Palm Angels Paradise Palm T-shirt Yellow - Talla L - Color amarillo,,T-SHIRT,PALM ANGELS,1399,
,3,,00001777,The Palm Back T-Shirt Black - Talla L - Color negro,,T-SHIRT,PALM ANGELS,1399,
,1,2,00001782,Palm Angels Paradise Palm T-shirt Yellow - Size L,DISEÑADOR,T-SHIRT,PALM ANGELS,1399,
,1,,00001786,Palm Angels x Haas MoneyGram F1 Team Monza T-Shirt TeeRed - Talla M - Color rojo,,T-SHIRT,PALM ANGELS,1399,
,1,,00001791,Palm Angels x Haas MoneyGram F1 Team Monza T-Shirt GreyLight - Talla M - Color Gris,,T-SHIRT,PALM ANGELS,1399,
,1,1,00001796,Palm Angels x Haas MoneyGram F1 Team Monza T-Shirt TeeRed - Size M,DISEÑADOR,T-SHIRT,PALM ANGELS,1399,
,1,,00001797,Dollar-print Oversized T-shirt in Cotton - Talla L - Color crema,,T-SHIRT,PALM ANGELS,1399,
,1,1,00001801,Snake Milano Classic Black Green - Talla M - Color negro (palmera con serpiente),DISEÑADOR,T-SHIRT,PALM ANGELS,1399,
,1,,00001808,Snake Milano Classic White Green - Talla XL - Color blanco (palmera con serpiente),,T-SHIRT,PALM ANGELS,1399,
,2,1,00001811,Palm Angels Burning Palm Over Black/Gold Talla M - Color Negro,DISEÑADOR,T-SHIRT,PALM ANGELS,1399,NO HAY UN REGISTRO EXACTO DE LA VENTA 
,1,1,00001818,Palm Angels Burning Palm Over Black/Gold Talla XL - Color Negro,DISEÑADOR,T-SHIRT,PALM ANGELS,1399,
,1,1,00001823,Palm Angels Burning Palm Over Black/Gold Talla XL - Color Negro,DISEÑADOR,T-SHIRT,PALM ANGELS,1399,
,1,,00001826,Palm Angels Monogram Stud Classic T-Shirt - Talla M - Color Negro,,T-SHIRT,PALM ANGELS,1399,
,1,1,00001831,Palm Angels Dice Game Classic T-shirt Black - Talla M - Color negro,DISEÑADOR,T-SHIRT,PALM ANGELS,1399,
,1,1,00001836,MONTE CARLO T-SHIRT MONEYGRAM HAAS F1 TEAM Grey - Talla M - Color gris,DISEÑADOR,T-SHIRT,PALM ANGELS,1399,
,1,,00001843,MONTE CARLO T-SHIRT MONEYGRAM HAAS F1 TEAM Black - Talla XL - Color negro,,T-SHIRT,PALM ANGELS,1399,
,1,,00001846,Palm Angels Bear in Mind T-shirt Black - Talla M - Color negro,,T-SHIRT,PALM ANGELS,1399,
,1,1,00001852,Palm Angels Bear in Mind T-shirt Black - Talla L - Color negro,DISEÑADOR,T-SHIRT,PALM ANGELS,1399,
,1,1,00001856,T-Shirt Loose With Dragon - Lunar New Year in red - Talla M - Color rojo,DISEÑADOR,T-SHIRT,PALM ANGELS,1399,
,1,1,00001862,Palm Angels Burning Logo Tee Black/Gold - Talla L - Color negro,DISEÑADOR,T-SHIRT,PALM ANGELS,1399,
,1,1,00001868,Arrow Skate Crew-Neck Relaxed-Fit Cotton-Jersey T-Shirt - Talla XL - color negro,DISEÑADOR,T-SHIRT,OFF WHITE,1800,
,2,1,00001871,Stitch Brand-Print T-Shirt Black - Talla M - Color negro,DISEÑADOR,T-SHIRT,OFF WHITE,1800,
,1,1,00001876,OFF-WHITE Banknote Arrow Ska SS Tee - Talla M - Color negro,DISEÑADOR,T-SHIRT,OFF WHITE,1800,
,1,1,00001883,Off White Flower Skate Regular Fit T-Shirt - Talla XL - Color negro,DISEÑADOR,T-SHIRT,OFF WHITE,1800,
,1,1,00001886,Off-White Virgil Abloh World Caterpillar White - Talla M - Color blanco,DISEÑADOR,T-SHIRT,OFF WHITE,1800,
,1,1,00001891,Off White Cut Here Arrow Skate Sweatshirt Black - Talla M - Color negro,DISEÑADOR,T-SHIRT,OFF WHITE,1800,
,1,1,00001898,OFF-WHITE Tape Arrow Skate Short Sleeve T-shirt White - Talla XL - Color blanco,DISEÑADOR,T-SHIRT,OFF WHITE,1800,
,0,1,00001901,OFF-WHITE Spray Arrow Slim SS Tee - Talla M - Color crema,DISEÑADOR,T-SHIRT,OFF WHITE,1800,
,1,1,00001906,OFF-WHITE ARROW EMB SKATE S/S TEE ANGORA WHITE - Talla M - Color crema,DISEÑADOR,T-SHIRT,OFF WHITE,1800,
,0,,00001910,T-shirt grigia con stampa logo - Talla XS - Color negro acid wash,,T-SHIRT,OFF WHITE,1800,
,1,1,00001916,Off White 90s Liquid Slim S/s T Shirt White/black - Talla M - Color blanco,DISEÑADOR,T-SHIRT,OFF WHITE,1800,
,1,1,00001922,Windy Green Cotton T-Shirt - Talla L - Color verde,DISEÑADOR,T-SHIRT,OFF WHITE,1800,
,1,1,00001928,Blue Tape Design Short Sleeve T-Shirt - Talla XL - Color turqueza,DISEÑADOR,T-SHIRT,OFF WHITE,1800,
,1,,00001931,Arrow Skate S/s Tee - Talla M - Color blanco,,T-SHIRT,OFF WHITE,1800,
,1,1,00001938,Men's Grey X Ac Milan Graphic-print Cotton - Talla XL - Color gris,DISEÑADOR,T-SHIRT,OFF WHITE,1400,
,1,1,00001941,Round Logo Skate T-shirt - Talla M - Color plomo,DISEÑADOR,T-SHIRT,OFF WHITE,1600,
,1,1,00001946,OFF WHITE STITCH T-SHIRT WITH LOGO - Talla M - Color caqui,DISEÑADOR,T-SHIRT,OFF WHITE,1600,
,1,1,00001951,Men's Logo Arrow Cotton Short Sleeve T-Shirt - Talla M - Color negro,DISEÑADOR,T-SHIRT,OFF WHITE,1800,
,2,2,00001952,Men's Logo Arrow Cotton Short Sleeve T-Shirt - Talla L - Color negro,DISEÑADOR,T-SHIRT,OFF WHITE,1800,
,1,1,00001958,Off-White LANDSCAPE T-shirt  Blue - Talla XL - Color azul,DISEÑADOR,T-SHIRT,OFF WHITE,1400,
,1,1,00001961,CARTOON ARROW_SLIM S/S TEE - Talla M - Color negro,DISEÑADOR,T-SHIRT,OFF WHITE,1800,
,1,1,00001966,2024 Lunar New Year Skate Tee - Size M - Color negro,DISEÑADOR,T-SHIRT,OFF WHITE,1800,
,1,1,00001971,Off-White Super Moon Arrow Slim Short-Sleeve Tee Black/Multicolor - Talla M - Color negro acid wash (luna),DISEÑADOR,T-SHIRT,OFF WHITE,1800,
,1,1,00001976,Off-White Mykonos Exclusive Virgil Tee - Talla M - Color blanco con celeste,DISEÑADOR,T-SHIRT,OFF WHITE,999,
,1,1,00001977,Off-White Mykonos Exclusive Virgil Tee - Talla L - Color blanco con celeste,DISEÑADOR,T-SHIRT,OFF WHITE,999,
,1,,00001983,Off- White Tornado Arrow T-shirt Black - Talla XL - Color negro,,T-SHIRT,OFF WHITE,1800,
,1,,00001987,Printed detail cotton Tee White - Talla L - Color blanco,,T-SHIRT,OFF WHITE,1400,
,1,1,00001991,Men's Short-Sleeve Longline T-Shirt - Talla M -Color negro,DISEÑADOR,T-SHIRT,OFF WHITE,1600,
,1,1,00001994,Men's Short-Sleeve Longline T-Shirt - Talla XXL -Color negro,DISEÑADOR,T-SHIRT,OFF WHITE,1600,
,1,1,00001997,"T-SHIRT ""CARAVAGGIO"" IN JERSEY DI COTONE - Talla L - Color negro",DISEÑADOR,T-SHIRT,OFF WHITE,1800,
,1,1,00001998,"T-SHIRT ""CARAVAGGIO"" IN JERSEY DI COTONE - Talla XL - Color negro",DISEÑADOR,T-SHIRT,OFF WHITE,1800,
,0,,00002003,"OFF-WHITE X DSM ""OPTIMISM"" 2020 ELECTION T-SHIRT WHITE - Talla XL - Color blanco",,T-SHIRT,OFF WHITE,1600,
,1,,00002006,OFF-WHITE Slim Fit Caravaggio Saint Jerome Writing T-shirt - Talla M - Color negro,,T-SHIRT,OFF WHITE,1800,
,2,2,00002012,off-white-off-white-mykonos exclusive arrow - Talla L - Color blanco,DISEÑADOR,T-SHIRT,OFF WHITE,1400,
,1,1,00002017,Off-White Bacchus Slim T-Shirt - Talla L - Color negro acid wash,DISEÑADOR,T-SHIRT,OFF WHITE,1800,
,1,1,00002020,OFF-White Arrow On Canvas Print Tee Black - Talla S - Color negro,DISEÑADOR,T-SHIRT,OFF WHITE,1800,
,1,1,00002028,Off-White White Cut Here Slim T-Shirt Grey - Talla XL -Color gris,DISEÑADOR,T-SHIRT,OFF WHITE,1800,
,1,1,00002032,OFF-WHITE Wave Diag Print Slim Fit T-Shirt Green/White - Talla L -Color verde,DISEÑADOR,T-SHIRT,OFF WHITE,1800,
,1,1,00002036,Ice cold cafe white T-shirt - Talla M - Color blanco cuello rojo,DISEÑADOR,T-SHIRT,OFF WHITE,1000,
,1,1,00002042,All In One T-shirt - Talla L - Color Perla,DISEÑADOR,T-SHIRT,OFF WHITE,1000,
,1,1,00002048,DB ALLOVER SLIM TEE BLACK WHITE - Talla XL - color blanco covertura,DISEÑADOR,T-SHIRT,OFF WHITE,1000,
,1,1,00002053,FORTE DEI MARMI T-shirt - Talla XL - Color Blanco,DISEÑADOR,T-SHIRT,OFF WHITE,1400,
,1,1,00002056,AL music over tee grey t-shirt - Talla M - Color gris (logo musica),DISEÑADOR,T-SHIRT,OFF WHITE,1400,
,1,1,00002060,Heron Preston Off-White 'CTNMB' Turtleneck T-Shirt - Talla XS - Color blanco,,T-SHIRT,HERON PRESTON,1400,
,0,,00002068,BAPE Mad Shark Photo Print Relaxed Fit Tee Black - Talla XL - Color negro,,T-SHIRT,BAPE,550,
,0,,00002072,BAPE X BURBERRY COLLAB T-SHIRT - Talla L - Color negro,,T-SHIRT,BAPE,550,
,1,1,00002078,Vale Forever Mt Valemore Tee White - Talla XL - Color Blanco,STREETWEAR LUJOSO,T-SHIRT,VALLEY FOREVER,899,
,1,1,00002080,Skull Print Cotton Jersey T-shirt In Black Green - Talla S - Color negro,DISEÑADOR,T-SHIRT,HERON PRESTON,899,
,1,1,00002088,Off White Carav Arrow Skate Crewneck Sweatshirt Black/white - Talla XL - Color negro,DISEÑADOR,T-SHIRT MANGA LARGA,OFF WHITE,2000,
,0,,00002093,Vale Forever Camo Futball Thermal - Talla XL - Color Amarillo,STREETWEAR LUJOSO,T-SHIRT MANGA LARGA,VALLEY FOREVER,899,
,1,1,00002095,Palm Angels Green Long Sleeve T Shirt - Talla S - Color verde agua,DISEÑADOR,T-SHIRT MANGA LARGA,PALM ANGELS,1500,
,1,,00002106,Off-White Green Abloh Applique Mesh Jersey Football - Talla M - Color verde,,JERSEY,OFF WHITE,1800,
,1,,00002112,perforated Jersey black - Talla L - Color negro,,JERSEY,OFF WHITE,1800,
,1,1,00003096,Bear Bowling Shirt Palm Angels Blue - Talla M (48) - Color azul,DISEÑADOR,SOBRE CAMISA,PALM ANGELS,1500,
,1,1,00003101,Palm Angels Bowling Shirt Green Black - Size M (48) - Color verde cuadros negros,DISEÑADOR,SOBRE CAMISA,PALM ANGELS,1500,
,1,,00003106,Moncler x Palm Angels Logo Patch T-Shirt Navy Blue - Talla M - Color azul marino,,T-SHIRT,PALM ANGELS X MONCLER,1400,
,1,1,00004222,Vale Forever Heritage Zip Up 'Green Forever - Talla L - Color verde,STREETWEAR LUJOSO,HOODIE,VALLEY FOREVER,1500,
,1,1,00004228,Vale Big Chain Hoodie Grey - Talla XL - Color gris,STREETWEAR LUJOSO,HOODIE,VALLEY FOREVER,1500,
,1,1,00004231,Valley Hoodie Stone Zip Up Black Crystals - Talla M - Color gris acid wash pedreria,STREETWEAR LUJOSO,HOODIE,VALLEY FOREVER,1700,
,1,2,00004337,Amiri Bleach Bandana Denim Trucker Jacket - Talla L - Color negro,DISEÑADOR,DENIM JACKET,AMIRI,6500,
,1,1,00004341,Supreme Satin Piping Pullover Light Blue - Talla M - Color celeste,STREETWEAR LUJOSO,SUETER,SUPREME,1500,
,1,1,00005056,Off-White Windy Arrow Skate Sweatshort Black/White - Talla M -Color negro,DISEÑADOR,SHORT,OFF WHITE,1500,
,0,,00005060,Off-White Caravaggio Arrows Mesh Shorts - Talla S - Color negro,,SHORT,OFF WHITE,1500,
,0,,00006053,PALM ANGELS Metallic Straight-leg Trousers In Off White - Talla 34 - Color Plata,,PANTALON JEANS,PALM ANGELS,2200,
,1,1,00006057,Palm Angels Bull Logo Patch Regular 5 Pocket Jeans Off White/Black - Talla 33 - Color blanco,DISEÑADOR,PANTALON JEANS,PALM ANGELS,2200,
,1,1,00006062,ICECREAM Black Running Dog Jean - Talla 32 - Color negro,STREETWEAR LUJOSO,PANTALON JEANS,ICE CREAM,1000,
,1,1,00006065,PURPLE BRAND Faded Crystal Racer Skinny Jeans Black - Talla 31 - Color negro acid wash,STREETWEAR LUJOSO,PANTALON JEANS,PURPLE,1600,
,1,2,00006070,AMIRI 3D Bones Skinny-Fit Distressed Appliquéd Jeans - Talla 30 -Color celeste,DISEÑADOR,PANTALON JEANS,AMIRI,2800,
,1,1,00006073,Off-White Babybrush Contour Jeans White/Multicolor - Talla 34 - Color Blanco,DISEÑADOR,PANTALON JEANS,OFF WHITE,2500,
,1,1,00006079,Palm Angels Curved Logo Back B 5 Pocke Light Blue White - Talla 36 - Color celeste,DISEÑADOR,PANTALON JEANS,PALM ANGELS,2200,
,1,1,00006084,Printed Skate-Fit Jeans - Talla 36 - Color blanco,DISEÑADOR,PANTALON JEANS,OFF WHITE,1800,
,1,0,00007044,Palm Angels Classic Tracksuit Bottoms - Talla XXL - Color negro,DISEÑADOR,PANTALON BUZO,PALM ANGELS,999,
,1,1,00007048,Vale Forever Prison Break Sweats - Talla XL - Color negro,STREETWEAR LUJOSO,PANTALON BUZO,VALLEY FOREVER,999,
,1,1,00007054,Curved Logo Loose Pants Black - Talla 36 (48) - Color Negro,DISEÑADOR,PANTALON BUZO,PALM ANGELS,999,
,1,,00004347,Heavy Fleece Vintage Shrunken Hoodie Black - Talla L - Color negro,,HOODIE,ESSENTIALS,750,
,1,1,00004352,Fear Of God Metallic Logo Hoodie ‘Homestead Heather’ SP25 - Size L - Color Beige,STREETWEAR LUJOSO,HOODIE,ESSENTIALS,750,
,1,,00004356,Fear Of God Hoodie  Green - Talla M - Color verde agua,,HOODIE,ESSENTIALS,750,
,1,1,00004361,Off White MonaLisa Denim Shirt in bleach blue & blue - Size M - Color celeste,DISEÑADOR,JACKET,OFF WHITE,1999,
,1,1,00002116,Godspeed V.O.D 2024 T-shirt Grey Wash Hombre - SS24 - Size M - Color negro acid wash,STREETWEAR LUJOSO,T-SHIRT,GOODSPEED,1200,
,1,1,00002122,Unisex SpongeBob SquarePants Cactus Plant Flea Market UT Black - Size L - Color negro,STREETWEAR LUJOSO,T-SHIRT,UNIQLO,300,
,0,1,00002128,SpongeBob SquarePants Cactus Plant Flea Market UT Green - Size XL - Color verde,STREETWEAR LUJOSO,T-SHIRT,UNIQLO,300,
,1,1,00002130,SpongeBob SquarePants Cactus Plant Flea Market UT Graphic T-Shirt - Size S - Color blanco,STREETWEAR LUJOSO,T-SHIRT,UNIQLO,300,
,0,,00002137,KAWS x Uniqlo Warhol UT Graphic white - Size L - Color blanco,,T-SHIRT,UNIQLO X KAWS,300,
,0,,00002142,Supreme Motion Logo Tee Healther Grey Men´s - Size L - Color Plomo,,T-SHIRT,SUPREME,550,
,1,1,00005073,Fear Of God Essentials Shorts Dark Oatmeal - Size XL - Color Plomo,STREETWEAR LUJOSO,SHORT,ESSENTIALS,550,
,1,1,00005077,Fear Of God Essentials Shorts Beige - Size L - Color beige,STREETWEAR LUJOSO,SHORT,ESSENTIALS,550,
,1,1,00005080,Fear Of God Essentials Shorts Smoke - Size XS - Color Caqui,STREETWEAR LUJOSO,SHORT,ESSENTIALS,550,
,-1,,00006082,Vale Forever Fury Painters Pant Black - Size 32 - Color negro acid wash pedreria,,PANTALON JEANS,VALLEY FOREVER,1500,
,1,2,00006087,VALE FOREVER 1980S CARPENTERS - Size 32 - Color medio verdoso estampados,STREETWEAR LUJOSO,PANTALON JEANS,VALLEY FOREVER,1500,
,1,,00006092,Vale Forever CHAIN PAINTERS - Size 32 - Color negro acid wash,,PANTALON JEANS,VALLEY FOREVER,1500,
,1,1,00006097,ICECREAM Sky blue Running Dog Jean - Size 32 - Color celeste,STREETWEAR LUJOSO,PANTALON JEANS,ICE CREAM,1000,
,1,1,00002145,Rhude Cross Tee Black - Size S - Color negro,DISEÑADOR,T-SHIRT,RHUDE,1599,
,1,1,00002151,Rhude Cotswold Crest T-Shirt Vintage Black - Size M - Color negro,DISEÑADOR,T-SHIRT,RHUDE,1599,
,1,1,00002160,Dog Tag Big Tee Black - Size S - Color negro,STREETWEAR LUJOSO,T-SHIRT,VALLEY FOREVER,799,
